<!DOCTYPE html>
<html   lang="en-US" >
<head id="head"><title>
	Nuclear Regulatory Commission
</title><meta name="description" content="Nuclear Regulatory Commission" /> 
<meta charset="UTF-8" /> 
<meta name="robots" content="noindex,nofollow" /> 


<!-- Global site tag (gtag.js) - Google Analytics -->
<script async src="https://www.googletagmanager.com/gtag/js?id=UA-33523145-1"></script>
<script>
  window.dataLayer = window.dataLayer || [];
  function gtag(){dataLayer.push(arguments);}
  gtag('js', new Date());
  gtag('config', 'UA-33523145-1');
</script>



<meta name="apple-mobile-web-app-title" content="NRC Web">
<meta name="application-name" content="NRC Web">
<meta name="msapplication-TileColor" content="#ffffff">
<meta name="theme-color" content="#ffffff">
<meta http-equiv="X-UA-Compatible" content="IE=edge">
<meta name="viewport" content="width=device-width, initial-scale=1.0">
<meta property="og:image:width" content="279">
<meta property="og:image:height" content="279">
<meta property="og:title" content="home">
 
<meta property="og:image" content='/cdn/site/logo/og-image.jpg'>

<meta property="og:site_name" content='NRC Web'>
<meta name="twitter:card" content="summary">
<meta name="twitter:creator" content="@NRC">
<meta name="twitter:site" content="@NRCgov">
<meta property="og:type" content="website">
<meta property="og:locale" content="en-US" />
<meta name="msapplication-config" content="/cdn/site/logo/browserconfig.xml">

<link rel="apple-touch-icon" sizes="180x180" href="/cdn/site/logo/apple-touch-icon.png">
<link rel="shortcut icon" href="/cdn/site/logo/favicon.ico">
<link rel="icon" type="image/png" sizes="32x32" href="/cdn/site/logo/favicon-32x32.png">
<link rel="icon" type="image/png" sizes="16x16" href="/cdn/site/logo/favicon-16x16.png">
<link rel="manifest" href="/cdn/site/logo/manifest.json">
<link rel="mask-icon" href="/cdn/site/logo/safari-pinned-tab.svg" color="#ffffff">
<script>(function() { 
var a = document.createElement('script');
a.type = 'text/javascript';
a.async = true;
a.src = 'https://cdn.gov.cfigroup.com/webmon/s/source/webmon/9de8b1c6db1117/webmon.js';;
var b = document.getElementsByTagName('script')[0];
b.parentNode.insertBefore(a, b);
})();
</script>
<!-- CORE CSS -->
<link href="/working/nrcweb/css/bundler.7D837481C91DFCB19D9013F33E147E79.css" rel="stylesheet" type="text/css" />
<link rel="canonical" href='https://www.nrc.gov/' /> 

                              <script>!function(e){var n="https://s.go-mpulse.net/boomerang/";if("True"=="True")e.BOOMR_config=e.BOOMR_config||{},e.BOOMR_config.PageParams=e.BOOMR_config.PageParams||{},e.BOOMR_config.PageParams.pci=!0,n="https://s2.go-mpulse.net/boomerang/";if(window.BOOMR_API_key="NY72W-PC7AC-AHREW-9TAVJ-VGMAW",function(){function e(){if(!r){var e=document.createElement("script");e.id="boomr-scr-as",e.src=window.BOOMR.url,e.async=!0,o.appendChild(e),r=!0}}function t(e){r=!0;var n,t,a,i,d=document,O=window;if(window.BOOMR.snippetMethod=e?"if":"i",t=function(e,n){var t=d.createElement("script");t.id=n||"boomr-if-as",t.src=window.BOOMR.url,BOOMR_lstart=(new Date).getTime(),e=e||d.body,e.appendChild(t)},!window.addEventListener&&window.attachEvent&&navigator.userAgent.match(/MSIE [67]\./))return window.BOOMR.snippetMethod="s",void t(o,"boomr-async");a=document.createElement("IFRAME"),a.src="about:blank",a.title="",a.role="presentation",a.loading="eager",i=(a.frameElement||a).style,i.width=0,i.height=0,i.border=0,i.display="none",o.appendChild(a);try{O=a.contentWindow,d=O.document.open()}catch(_){n=document.domain,a.src="javascript:var d=document.open();d.domain='"+n+"';void 0;",O=a.contentWindow,d=O.document.open()}if(n)d._boomrl=function(){this.domain=n,t()},d.write("<bo"+"dy onload='document._boomrl();'>");else if(O._boomrl=function(){t()},O.addEventListener)O.addEventListener("load",O._boomrl,!1);else if(O.attachEvent)O.attachEvent("onload",O._boomrl);d.close()}function a(e){window.BOOMR_onload=e&&e.timeStamp||(new Date).getTime()}if(!window.BOOMR||!window.BOOMR.version&&!window.BOOMR.snippetExecuted){window.BOOMR=window.BOOMR||{},window.BOOMR.snippetStart=(new Date).getTime(),window.BOOMR.snippetExecuted=!0,window.BOOMR.snippetVersion=14,window.BOOMR.url=n+"NY72W-PC7AC-AHREW-9TAVJ-VGMAW";var i=document.currentScript||document.getElementsByTagName("script")[0],o=i.parentNode,r=!1,d=document.createElement("link");if(d.relList&&"function"==typeof d.relList.supports&&d.relList.supports("preload")&&"as"in d)window.BOOMR.snippetMethod="p",d.href=window.BOOMR.url,d.rel="preload",d.as="script",d.addEventListener("load",e),d.addEventListener("error",function(){t(!0)}),setTimeout(function(){if(!r)t(!0)},3e3),BOOMR_lstart=(new Date).getTime(),o.appendChild(d);else t(!1);if(window.addEventListener)window.addEventListener("load",a,!1);else if(window.attachEvent)window.attachEvent("onload",a)}}(),"".length>0)if(e&&"performance"in e&&e.performance&&"function"==typeof e.performance.setResourceTimingBufferSize)e.performance.setResourceTimingBufferSize();!function(){if(BOOMR=e.BOOMR||{},BOOMR.plugins=BOOMR.plugins||{},!BOOMR.plugins.AK){var n=""=="true"?1:0,t="",a="b2fzmqqx2ooqqzi5z25q-f-45e17fd46-clientnsv4-s.akamaihd.net",i="false"=="true"?2:1,o={"ak.v":"36","ak.cp":"1135018","ak.ai":parseInt("670380",10),"ak.ol":"0","ak.cr":22,"ak.ipv":4,"ak.proto":"http/1.1","ak.rid":"5db8ece","ak.r":40323,"ak.a2":n,"ak.m":"dsca","ak.n":"essl","ak.bpcip":"14.139.150.0","ak.cport":49902,"ak.gh":"23.55.246.244","ak.quicv":"","ak.tlsv":"tls1.3","ak.0rtt":"","ak.csrc":"-","ak.acc":"reno","ak.t":"1696452283","ak.ak":"hOBiQwZUYzCg5VSAfCLimQ==9NTkWy3/PChYy0yiAiyb95DHbOuauD+tSmpT1znaxTS1HdPcs3Pf4o5t4EIYNBsj+cCDsMSSjSZThDKCoHMtbeKERRnrx8nDicUYz9zzftxWhCOoZlbr/Z6AMFz+bkT9dj73Tz1Brt75pZsymjpiTvAvMEdGGz4Btdf8hhljiThEIjNH/FZMKQTFfcdfrDCU+6xyq0Hj85BHdq+Iz+OHQ4wmw1+Emw/4Ne7KUJf1rqVGq4tEMbhfd+ffrlrluQM+CcHD3hgoNsFs8aUzcOWUpSmAMv3IqlM0B9r3w2LkTlvzj35kIg6RD0cVgVdtkhq4duQtsdDkPkGVj61CIUFEYFLDUoXM7qbQz/0zihSFBKxmcYlw8b/6ARcrbmuEcPXwDXPv0pnMfGPHlxRE5od+X5sQH4kFekYz+f8p4/Y08gQ=","ak.pv":"110","ak.dpoabenc":"","ak.tf":i};if(""!==t)o["ak.ruds"]=t;var r={i:!1,av:function(n){var t="http.initiator";if(n&&(!n[t]||"spa_hard"===n[t]))o["ak.feo"]=void 0!==e.aFeoApplied?1:0,BOOMR.addVar(o)},rv:function(){var e=["ak.bpcip","ak.cport","ak.cr","ak.csrc","ak.gh","ak.ipv","ak.m","ak.n","ak.ol","ak.proto","ak.quicv","ak.tlsv","ak.0rtt","ak.r","ak.acc","ak.t","ak.tf"];BOOMR.removeVar(e)}};BOOMR.plugins.AK={akVars:o,akDNSPreFetchDomain:a,init:function(){if(!r.i){var e=BOOMR.subscribe;e("before_beacon",r.av,null,null),e("onbeacon",r.rv,null,null),r.i=!0}return this},is_complete:function(){return!0}}}}()}(window);</script></head>
<body class="LTR Chrome ENUS ContentBody" >
    
    <form method="post" action="/" id="form">
<div class="aspNetHidden">
<input type="hidden" name="__EVENTTARGET" id="__EVENTTARGET" value="" />
<input type="hidden" name="__EVENTARGUMENT" id="__EVENTARGUMENT" value="" />

</div>

<script type="text/javascript">
//<![CDATA[
var theForm = document.forms['form'];
if (!theForm) {
    theForm = document.form;
}
function __doPostBack(eventTarget, eventArgument) {
    if (!theForm.onsubmit || (theForm.onsubmit() != false)) {
        theForm.__EVENTTARGET.value = eventTarget;
        theForm.__EVENTARGUMENT.value = eventArgument;
        theForm.submit();
    }
}
//]]>
</script>


<script src="/WebResource.axd?d=pynGkmcFUV13He1Qd6_TZNyrqkTFBLVH56uyeCoMaUYaY9bSM0aV9VynHtxJo91FwpABBsU-rkHbUFRdWULW4Q2&amp;t=637814653746327080" type="text/javascript"></script>

<input type="hidden" name="lng" id="lng" value="en-US" />
<script type="text/javascript">
	//<![CDATA[

function PM_Postback(param) { if (window.top.HideScreenLockWarningAndSync) { window.top.HideScreenLockWarningAndSync(1080); } if(window.CMSContentManager) { CMSContentManager.allowSubmit = true; }; __doPostBack('m$am',param); }
function PM_Callback(param, callback, ctx) { if (window.top.HideScreenLockWarningAndSync) { window.top.HideScreenLockWarningAndSync(1080); }if (window.CMSContentManager) { CMSContentManager.storeContentChangedStatus(); };WebForm_DoCallback('m$am',param,callback,ctx,null,true); }
//]]>
</script>
<script type="text/javascript">
	//<![CDATA[

var CMS = CMS || {};
CMS.Application = {
  "language": "en",
  "imagesUrl": "/CMSPages/GetResource.ashx?image=%5bImages.zip%5d%2f",
  "isDebuggingEnabled": false,
  "applicationUrl": "/",
  "isDialog": false,
  "isRTL": "false"
};

//]]>
</script>
<div class="aspNetHidden">

	<input type="hidden" name="__VIEWSTATEGENERATOR" id="__VIEWSTATEGENERATOR" value="A5343185" />
	<input type="hidden" name="__SCROLLPOSITIONX" id="__SCROLLPOSITIONX" value="0" />
	<input type="hidden" name="__SCROLLPOSITIONY" id="__SCROLLPOSITIONY" value="0" />
</div> 
    
    <div id="ctxM">

</div>
    <div id="container-wrap"> 
  <!-- Begin Header -->
  <header>
    <!-- Begin Print Logo -->
    
    <!-- End Print Logo -->
    <div class="navbar revised">
      <!-- Begin Mobile Logo and Hamburger Icon -->
      <div class="navbar-header">
        <div class="container">
          <!-- Begin Hamburger Icon -->
          <a class="navbar-toggle btn responsive-menu pull-right" data-toggle="collapse" data-target=".navbar-collapse"><i class='icon-fontello-menu-1'></i></a>
          <!-- End Hamburger Icon -->
          <!-- Begin Top Header -->
          <ul class="info pull-left">
            
          </ul>
          <ul class="social pull-right hide-menu-for-mobile">
            
    <li class="header-link">
      <a id="p_lt_WebPartZone3_zRightHeader_CORE_V1_Header_Link_btnElem_hyperLink" href="/reading-rm/faqlist.html" target="_self"><span id="p_lt_WebPartZone3_zRightHeader_CORE_V1_Header_Link_btnElem_lblText">FAQ</span></a>
    </li>
    
    <li class="header-link">
      <a id="p_lt_WebPartZone3_zRightHeader_CORE_V1_Header_Link1_btnElem_hyperLink" href="/agreement-states.html" target="_self"><span id="p_lt_WebPartZone3_zRightHeader_CORE_V1_Header_Link1_btnElem_lblText">AGREEMENT STATES</span></a>
    </li>
    
    <li class="header-link">
      <a id="p_lt_WebPartZone3_zRightHeader_CORE_V1_Header_Link2_btnElem_hyperLink" href="/info-finder.html" target="_self"><span id="p_lt_WebPartZone3_zRightHeader_CORE_V1_Header_Link2_btnElem_lblText">Facility Locator</span></a>
    </li>
    
    <li class="header-link">
      <a id="p_lt_WebPartZone3_zRightHeader_CORE_V1_Header_Link3_btnElem_hyperLink" href="/site-help/new-content.html" target="_self"><span id="p_lt_WebPartZone3_zRightHeader_CORE_V1_Header_Link3_btnElem_lblText">What&#39;s New</span></a>
    </li>
    
    <li class="header-link">
      <a id="p_lt_WebPartZone3_zRightHeader_CORE_V1_Header_Link4_btnElem_hyperLink" href="/site-help.html" target="_self"><span id="p_lt_WebPartZone3_zRightHeader_CORE_V1_Header_Link4_btnElem_lblText">Site Help</span></a>
    </li>
    
    <li class="header-link">
      <a id="p_lt_WebPartZone3_zRightHeader_CORE_V1_Header_Link5_btnElem_hyperLink" href="/site-help/index-az.html" target="_self"><span id="p_lt_WebPartZone3_zRightHeader_CORE_V1_Header_Link5_btnElem_lblText">Index A-Z</span></a>
    </li>
    
    <li class="header-link">
      <a id="p_lt_WebPartZone3_zRightHeader_CORE_V1_Header_Link6_btnElem_hyperLink" href="/about-nrc/contactus.html" target="_self"><span id="p_lt_WebPartZone3_zRightHeader_CORE_V1_Header_Link6_btnElem_lblText">Contact Us</span></a>
    </li>
    
    <li class="header-link">
      <a id="p_lt_WebPartZone3_zRightHeader_CORE_V1_Header_Link7_btnElem_hyperLink" href="/public-involve/listserver.html" target="_self"><span id="p_lt_WebPartZone3_zRightHeader_CORE_V1_Header_Link7_btnElem_lblText">Email Updates</span></a>
    </li>
    
          </ul>
          <div style="position: relative;">
            <div id="xp1" class="rs_addtools rs_splitbutton rs_preserve rs_skip" style="z-index: 99; position: absolute; top: 13px; left: 578px;"></div>
          </div>
          <!-- End Top Header -->
          
          <!-- Begin Zone for Mobile Logo -->
          <a class="navbar-brand" href="/">
            <img src="/cdn/site/logo/logo.png" class="logo" alt="Nuclear Regulatory Commission Logo">
          </a>
          <!-- End Zone for Mobile Logo -->
        </div>
      </div>
      <!-- End Mobile Logo and Hamburger Icon -->
      
      
      
      <!-- Begin Main Navigation, Desktop Logo, and Search Dropdown --> 
      <div class="yamm">
        <div class="navbar-band with-social">
          <div class="container">
            <div class="row">
              <div class="col-sm-12">
                <!-- Begin Desktop Logo -->
                <div class="pull-left nav-logo">
                  <a class="logo" href="/">
                     <img src="/cdn/site/logo/logo.png" class="logo" alt="Nuclear Regulatory Commission Logo">
                  </a>
                </div>
                <!-- End Desktop Logo -->
                <!-- Begin Search and Other Comp -->
                <div class="pull-right navbar-search inline">
                  <span class="btn-widget text-center">
  <a href="/about-nrc/regulatory/allegations/safety-concern.html" class="btn btn-medium quaternary-background full-width black" target="_self">Report a Safety Concern</a>
</span>
                  <div class="searchBox">
  <input name="master-search" type="text"  id="master-search" class="search-box form-control" aria-label="Site Search">
  <a href="/site-help/Search-Results?site=AllSites" id="master-search-btn" class="search-button btn btn-default">Search</a>
</div>
                  <ul class="social header hide-menu-for-mobile">
                    
<!--Facebook-->
<li class='header-link social'><a href='https://www.facebook.com/nrcgov/' target='_blank' title='NRC Facebook' rel='noopener noreferrer'><i class='icon-fontello-s-facebook'></i></a></li>
<!--Twitter-->
<li class='header-link social'><a href='https://twitter.com/nrcgov' target='_blank' title='NRC Twitter Feed' rel='noopener noreferrer'><i class='icon-fontello-s-twitter'></i></a></li>
<!--Linkedin-->
<li class='header-link social'><a href='https://www.linkedin.com/company/u-s--nuclear-regulatory-commission/' target='_blank' title='NRC Linkedin' rel='noopener noreferrer'><i class='icon-fontello-s-linkedin'></i></a></li>
<!--Instagram-->
<li class='header-link social'><a href='https://www.instagram.com/nrcgov' target='_blank' title='NRC Instagram' rel='noopener noreferrer'><i class='icon-fontello-s-instagram'></i></a></li>
<!-- YouTube -->
<li class='header-link social'><a href='https://www.youtube.com/user/NRCgov' target='_blank' title='NRC YouTube Channel' rel='noopener noreferrer'><i class='icon-fontello-s-youtube'></i></a></li>
<!--Pinterest-->

<!--Flickr-->
<li class='header-link social'><a href='https://www.flickr.com/photos/nrcgov/sets' target='_blank' title='NRC Flickr Gallery' rel='noopener noreferrer'><i class='icon-fontello-s-flickr'></i></a></li>
<!--Blog-->
<li class='header-link social'><a href='https://public-blog.nrc-gateway.gov/' target='_blank' title='NRC Blog Archived' rel='noopener noreferrer'><i class='icon-fontello-pencil'></i></a></li>
<!--Subscribe-->
<li class='header-link social'><a href='https://service.govdelivery.com/service/multi_subscribe.html?code=USNRC' target='_blank' title='NRC Email Subscriptions - GovDelivery' rel='noopener noreferrer'><i class='icon-fontello-comment'></i></a></li>
<!--RSS-->
<li class='header-link social'><a href='/public-involve/listserver.html#rss' target='_self' title='NRC RSS Feed'><i class='icon-fontello-rss'></i></a></li>

                  </ul>
                  <!-- End Search and Other Comp -->
                </div>
              </div>
            </div>
          </div>
        </div>
        <div class="navbar-collapse collapse">
          <div class="container">
            <!-- Begin Main Navigation -->
            <ul class="nav navbar-nav">
              <li class="dropdown yamm-fullwidth">
  <a href="/reactors.html" class="dropdown-toggle">Nuclear Reactors</a>
  <a class="angle top-level" data-toggle="dropdown" href="#"></a>
  <ul class="dropdown-menu yamm-dropdown-menu">
    <li>
      <div class="yamm-content">
<div class="container"><div class="row inner-top-xs general-content  "><div class="mb-pd-btm col-sm-4"><a id="mm3c1_CORE_V1_InPageLink_btnElem_hyperLink" href="/reactors/power.html" target="_self"><span id="mm3c1_CORE_V1_InPageLink_btnElem_lblText">Power Reactors</span></a>
<a id="mm3c1_CORE_V1_InPageLink1_btnElem_hyperLink" href="/reactors/non-power.html" target="_self"><span id="mm3c1_CORE_V1_InPageLink1_btnElem_lblText">Research &amp; Test Reactors</span></a>
</div><div class="mb-pd-btm col-sm-4"><a id="mm3c2_CORE_V1_InPageLink2_btnElem_hyperLink" href="/reactors/operating.html" target="_self"><span id="mm3c2_CORE_V1_InPageLink2_btnElem_lblText">Operating Reactors</span></a>
<a id="mm3c2_CORE_V1_InPageLink3_btnElem_hyperLink" href="/reactors/new-reactors.html" target="_self"><span id="mm3c2_CORE_V1_InPageLink3_btnElem_lblText">New Reactors</span></a>
</div><div class="mb-pd-btm col-sm-4"><a id="mm3c3_CORE_V1_InPageLink4_btnElem_hyperLink" href="/reactors/operator-licensing.html" target="_self"><span id="mm3c3_CORE_V1_InPageLink4_btnElem_lblText">Operator Licensing</span></a>
<a id="mm3c3_CORE_V1_InPageLink5_btnElem_hyperLink" href="/about-nrc/regulatory/research.html" target="_self"><span id="mm3c3_CORE_V1_InPageLink5_btnElem_lblText">Research Activities</span></a>
</div></div></div><div class="container"><div class="row  inner-top-xs general-content  "><div class="col-md-12"><hr class="line dashed-line-brand-color-yellow"/><a id="mm1c1_CORE_V1_InPageLink6_btnElem_hyperLink" class="quick-link" href="/reactors/ql-reactors.html" target="_self"><span id="mm1c1_CORE_V1_InPageLink6_btnElem_lblText">Nuclear Reactor Quick Links</span></a>
</div></div></div></div>
</li>
</ul>
</li><li class="dropdown yamm-fullwidth">
  <a href="/materials.html" class="dropdown-toggle">Nuclear Materials</a>
  <a class="angle top-level" data-toggle="dropdown" href="#"></a>
  <ul class="dropdown-menu yamm-dropdown-menu">
    <li>
      <div class="yamm-content">
<div class="container"><div class="row inner-top-xs general-content  "><div class="mb-pd-btm col-sm-4"><a id="mm13c1_CORE_V1_InPageLink_btnElem_hyperLink" href="/materials/types.html" target="_self"><span id="mm13c1_CORE_V1_InPageLink_btnElem_lblText">Types of Nuclear Materials</span></a>
<a id="mm13c1_CORE_V1_InPageLink4_btnElem_hyperLink" href="/materials/fuel-cycle-fac.html" target="_self"><span id="mm13c1_CORE_V1_InPageLink4_btnElem_lblText">Fuel Cycle Facilities</span></a>
<a id="mm13c1_CORE_V1_InPageLink2_btnElem_hyperLink" href="/materials/medical.html" target="_self"><span id="mm13c1_CORE_V1_InPageLink2_btnElem_lblText">Medical, Industrial, &amp; Academic Uses</span></a>
</div><div class="mb-pd-btm col-sm-4"><a id="mm13c2_CORE_V1_InPageLink7_btnElem_hyperLink" href="/materials/uranium-recovery.html" target="_self"><span id="mm13c2_CORE_V1_InPageLink7_btnElem_lblText">Uranium Recovery</span></a>
<a id="mm13c2_CORE_V1_InPageLink5_btnElem_hyperLink" href="/materials/transportation.html" target="_self"><span id="mm13c2_CORE_V1_InPageLink5_btnElem_lblText">Materials Transportation</span></a>
</div><div class="mb-pd-btm col-sm-4"><a id="mm13c3_CORE_V1_InPageLink1_btnElem_hyperLink" href="/materials/active-nepa-reviews.html" target="_self"><span id="mm13c3_CORE_V1_InPageLink1_btnElem_lblText">Materials Environmental Reviews</span></a>
<a id="mm13c3_CORE_V1_InPageLink3_btnElem_hyperLink" href="/materials/nmp.html" target="_self"><span id="mm13c3_CORE_V1_InPageLink3_btnElem_lblText">National Materials Program</span></a>
</div></div></div><div class="container"><div class="row  inner-top-xs general-content  "><div class="col-md-12"><hr class="line dashed-line-brand-color-yellow"/><a id="mm11c1_CORE_V1_InPageLink9_btnElem_hyperLink" class="quick-link" href="/materials/ql-materials.html" target="_self"><span id="mm11c1_CORE_V1_InPageLink9_btnElem_lblText">Nuclear Materials Quick Links</span></a>
</div></div></div></div>
</li>
</ul>
</li><li class="dropdown yamm-fullwidth">
  <a href="/waste.html" class="dropdown-toggle">Radioactive Waste</a>
  <a class="angle top-level" data-toggle="dropdown" href="#"></a>
  <ul class="dropdown-menu yamm-dropdown-menu">
    <li>
      <div class="yamm-content">
<div class="container"><div class="row inner-top-xs general-content  "><div class="mb-pd-btm col-sm-4"><a id="mm23c1_CORE_V1_InPageLink_btnElem_hyperLink" href="/waste/decommissioning.html" target="_self"><span id="mm23c1_CORE_V1_InPageLink_btnElem_lblText">Decommissioning of Nuclear Facilities</span></a>
<a id="mm23c1_CORE_V1_InPageLink1_btnElem_hyperLink" href="/waste/low-level-waste.html" target="_self"><span id="mm23c1_CORE_V1_InPageLink1_btnElem_lblText">Low-Level Waste</span></a>
<a id="mm23c1_CORE_V1_InPageLink6_btnElem_hyperLink" href="/waste/incidental-waste.html" target="_self"><span id="mm23c1_CORE_V1_InPageLink6_btnElem_lblText">Waste Incidental to Reprocessing</span></a>
<a id="mm23c1_CORE_V1_InPageLink7_btnElem_hyperLink" href="/waste/high-level-waste.html" target="_self"><span id="mm23c1_CORE_V1_InPageLink7_btnElem_lblText">High-Level Waste</span></a>
</div><div class="mb-pd-btm col-sm-4"><a id="mm23c2_CORE_V1_InPageLink2_btnElem_hyperLink" href="/waste/mill-tailings.html" target="_self"><span id="mm23c2_CORE_V1_InPageLink2_btnElem_lblText">Uranium Mill Tailings</span></a>
<a id="mm23c2_CORE_V1_InPageLink3_btnElem_hyperLink" href="/waste/llw-disposal.html" target="_self"><span id="mm23c2_CORE_V1_InPageLink3_btnElem_lblText">Low-Level Waste Disposal</span></a>
<a id="mm23c2_CORE_V1_InPageLink9_btnElem_hyperLink" href="/waste/hlw-disposal.html" target="_self"><span id="mm23c2_CORE_V1_InPageLink9_btnElem_lblText">High-Level Waste Disposal</span></a>
</div><div class="mb-pd-btm col-sm-4"><a id="mm23c3_CORE_V1_InPageLink8_btnElem_hyperLink" href="/waste/spent-fuel-storage.html" target="_self"><span id="mm23c3_CORE_V1_InPageLink8_btnElem_lblText">Storage of Spent Nuclear Fuel</span></a>
<a id="mm23c3_CORE_V1_InPageLink4_btnElem_hyperLink" href="/waste/spent-fuel-transp.html" target="_self"><span id="mm23c3_CORE_V1_InPageLink4_btnElem_lblText">Transportation of Spent Nuclear Fuel</span></a>
<a id="mm23c3_CORE_V1_InPageLink5_btnElem_hyperLink" href="/about-nrc/regulatory/research.html" target="_self"><span id="mm23c3_CORE_V1_InPageLink5_btnElem_lblText">Research Activities</span></a>
</div></div></div><div class="container"><div class="row  inner-top-xs general-content  "><div class="col-md-12"><hr class="line dashed-line-brand-color-yellow"/><a id="mm21c1_CORE_V1_InPageLink10_btnElem_hyperLink" class="quick-link" href="/waste/ql-waste.html" target="_self"><span id="mm21c1_CORE_V1_InPageLink10_btnElem_lblText">Radioactive Waste Quick Links</span></a>
</div></div></div></div>
</li>
</ul>
</li><li class="dropdown yamm-fullwidth">
  <a href="/security.html" class="dropdown-toggle">Nuclear Security</a>
  <a class="angle top-level" data-toggle="dropdown" href="#"></a>
  <ul class="dropdown-menu yamm-dropdown-menu">
    <li>
      <div class="yamm-content">
<div class="container"><div class="row inner-top-xs general-content  "><div class="mb-pd-btm col-sm-4"><a id="mm33c1_CORE_V1_InPageLink_btnElem_hyperLink" href="/security/domestic.html" target="_self"><span id="mm33c1_CORE_V1_InPageLink_btnElem_lblText">Domestic Safeguards</span></a>
<a id="mm33c1_CORE_V1_InPageLink1_btnElem_hyperLink" href="/security/info-security.html" target="_self"><span id="mm33c1_CORE_V1_InPageLink1_btnElem_lblText">Information Security</span></a>
<a id="mm33c1_CORE_V1_InPageLink6_btnElem_hyperLink" href="/security/byproduct.html" target="_self"><span id="mm33c1_CORE_V1_InPageLink6_btnElem_lblText">Radioactive Material Security</span></a>
</div><div class="mb-pd-btm col-sm-4"><a id="mm33c2_CORE_V1_InPageLink2_btnElem_hyperLink" href="/security/required-reporting-for-clearance-holders.html" target="_self"><span id="mm33c2_CORE_V1_InPageLink2_btnElem_lblText">Required Reporting for Clearance Holders</span></a>
<a id="mm33c2_CORE_V1_InPageLink3_btnElem_hyperLink" href="/security/insider-threat-program-for-licensees.html" target="_self"><span id="mm33c2_CORE_V1_InPageLink3_btnElem_lblText">Insider Threat Program for Licensees</span></a>
<a id="mm33c2_CORE_V1_InPageLink7_btnElem_hyperLink" href="/security/cybersecurity.html" target="_self"><span id="mm33c2_CORE_V1_InPageLink7_btnElem_lblText">Cybersecurity</span></a>
</div><div class="mb-pd-btm col-sm-4"><a id="mm33c3_CORE_V1_InPageLink4_btnElem_hyperLink" href="/security/chp.html" target="_self"><span id="mm33c3_CORE_V1_InPageLink4_btnElem_lblText">Criminal History &amp; Firearms Checks</span></a>
<a id="mm33c3_CORE_V1_InPageLink5_btnElem_hyperLink" href="/security/contactus.html" target="_self"><span id="mm33c3_CORE_V1_InPageLink5_btnElem_lblText">Contact Us</span></a>
</div></div></div></div>
</li>
</ul>
</li><li class="dropdown yamm-fullwidth">
  <a href="/public-involve.html" class="dropdown-toggle">Public Meetings & Involvement</a>
  <a class="angle top-level" data-toggle="dropdown" href="#"></a>
  <ul class="dropdown-menu yamm-dropdown-menu">
    <li>
      <div class="yamm-content">
<div class="container"><div class="row inner-top-xs general-content  "><div class="mb-pd-btm col-sm-4"><a id="mm43c1_CORE_V1_InPageLink_btnElem_hyperLink" href="/public-involve/open.html" target="_self"><span id="mm43c1_CORE_V1_InPageLink_btnElem_lblText">The NRC Approach to Open Government</span></a>
<a id="mm43c1_CORE_V1_InPageLink1_btnElem_hyperLink" href="/public-involve/public-meetings.html" target="_self"><span id="mm43c1_CORE_V1_InPageLink1_btnElem_lblText">About Meetings Open to the Public</span></a>
<a id="mm43c1_CORE_V1_InPageLink6_btnElem_hyperLink" href="/public-involve/conferences.html" target="_self"><span id="mm43c1_CORE_V1_InPageLink6_btnElem_lblText">Conferences &amp; Symposia</span></a>
</div><div class="mb-pd-btm col-sm-4"><a id="mm43c2_CORE_V1_InPageLink7_btnElem_hyperLink" href="/public-involve/doc-comment.html" target="_self"><span id="mm43c2_CORE_V1_InPageLink7_btnElem_lblText">Documents for Comment</span></a>
<a id="mm43c2_CORE_V1_InPageLink2_btnElem_hyperLink" href="/about-nrc/regulatory/rulemaking/rules-petitions.html" target="_self"><span id="mm43c2_CORE_V1_InPageLink2_btnElem_lblText">NRC Rules and Petitions</span></a>
<a id="mm43c2_CORE_V1_InPageLink3_btnElem_hyperLink" href="/public-involve/stakeholder-involvement.html" target="_self"><span id="mm43c2_CORE_V1_InPageLink3_btnElem_lblText">Facilitating Stakeholder Involvement</span></a>
</div><div class="mb-pd-btm col-sm-4"><a id="mm43c3_CORE_V1_InPageLink8_btnElem_hyperLink" href="/public-involve/info-quality.html" target="_self"><span id="mm43c3_CORE_V1_InPageLink8_btnElem_lblText">NRC Information Quality Guidelines</span></a>
<a id="mm43c3_CORE_V1_InPageLink9_btnElem_hyperLink" href="/public-involve/listserver.html" target="_self"><span id="mm43c3_CORE_V1_InPageLink9_btnElem_lblText">Subscribe to E-mail Updates</span></a>
</div></div></div><div class="container"><div class="row  inner-top-xs general-content  "><div class="col-md-12"><hr class="line dashed-line-brand-color-yellow"/></div></div></div><div class="container"><div class="row inner-top-xs general-content  "><div class="mb-pd-btm col-md-4"><a id="mm431c1_CORE_V1_InPageLink4_btnElem_hyperLink" class="quick-link" href="/public-involve/public-meetings/schedule.html" target="_self"><span id="mm431c1_CORE_V1_InPageLink4_btnElem_lblText">Commission Schedule</span></a>
<a id="mm431c1_CORE_V1_InPageLink5_btnElem_hyperLink" class="quick-link" href="/pmns/mtg" target="_self"><span id="mm431c1_CORE_V1_InPageLink5_btnElem_lblText">Public Meeting Schedule</span></a>
</div><div class="mb-pd-btm col-md-4"><a id="mm431c2_CORE_V1_InPageLink10_btnElem_hyperLink" class="quick-link" href="/about-nrc/regulatory/adjudicatory.html" target="_self"><span id="mm431c2_CORE_V1_InPageLink10_btnElem_lblText">Adjudications (Hearings)</span></a>
<a id="mm431c2_CORE_V1_InPageLink11_btnElem_hyperLink" class="quick-link" href="/site-help/e-submittals/adjudicatory-sub.html" target="_self"><span id="mm431c2_CORE_V1_InPageLink11_btnElem_lblText">Adjudicatory Submissions</span></a>
</div><div class="mb-pd-btm col-md-4"></div></div></div></div>
</li>
</ul>
</li><li class="dropdown yamm-fullwidth">
  <a href="/reading-rm.html" class="dropdown-toggle">NRC Library</a>
  <a class="angle top-level" data-toggle="dropdown" href="#"></a>
  <ul class="dropdown-menu yamm-dropdown-menu">
    <li>
      <div class="yamm-content">
<div class="container"><div class="row inner-top-xs general-content  "><div class="mb-pd-btm col-sm-4"><a id="mm53c1_CORE_V1_InPageLink_btnElem_hyperLink" href="/reading-rm/basic-ref.html" target="_self"><span id="mm53c1_CORE_V1_InPageLink_btnElem_lblText">Basic References</span></a>
<a id="mm53c1_CORE_V1_InPageLink1_btnElem_hyperLink" href="/reading-rm/doc-collections/index.html" target="_self"><span id="mm53c1_CORE_V1_InPageLink1_btnElem_lblText">Document Collections</span></a>
<a id="mm53c1_CORE_V1_InPageLink6_btnElem_hyperLink" href="/reading-rm/adams.html" target="_self"><span id="mm53c1_CORE_V1_InPageLink6_btnElem_lblText">ADAMS Public Documents</span></a>
<a id="mm53c1_CORE_V1_InPageLink8_btnElem_hyperLink" href="/reading-rm/pdr.html" target="_self"><span id="mm53c1_CORE_V1_InPageLink8_btnElem_lblText">Public Document Room</span></a>
<a id="mm53c1_CORE_V1_InPageLink7_btnElem_hyperLink" href="/reading-rm/lsn/index.html" target="_self"><span id="mm53c1_CORE_V1_InPageLink7_btnElem_lblText">LSN Library</span></a>
</div><div class="mb-pd-btm col-sm-4"><a id="mm53c2_CORE_V1_InPageLink2_btnElem_hyperLink" href="/reading-rm/foia/foia-privacy.html" target="_self"><span id="mm53c2_CORE_V1_InPageLink2_btnElem_lblText">FOIA &amp; Privacy Act</span></a>
<a id="mm53c2_CORE_V1_InPageLink3_btnElem_hyperLink" href="/reading-rm/photo-gallery/index.html" target="_self"><span id="mm53c2_CORE_V1_InPageLink3_btnElem_lblText">Photos &amp; Videos</span></a>
<a id="mm53c2_CORE_V1_InPageLink9_btnElem_hyperLink" href="/reading-rm/records-mgmt.html" target="_self"><span id="mm53c2_CORE_V1_InPageLink9_btnElem_lblText">Records Management</span></a>
<a id="mm53c2_CORE_V1_InPageLink10_btnElem_hyperLink" href="/reading-rm/training.html" target="_self"><span id="mm53c2_CORE_V1_InPageLink10_btnElem_lblText">Training Courses</span></a>
</div><div class="mb-pd-btm col-sm-4"><a id="mm53c3_CORE_V1_InPageLink11_btnElem_hyperLink" href="/reading-rm/faqlist.html" target="_self"><span id="mm53c3_CORE_V1_InPageLink11_btnElem_lblText">FAQ Index</span></a>
<a id="mm53c3_CORE_V1_InPageLink4_btnElem_hyperLink" href="/reading-rm/copies-docs.html" target="_self"><span id="mm53c3_CORE_V1_InPageLink4_btnElem_lblText">Get Copies of Documents</span></a>
<a id="mm53c3_CORE_V1_InPageLink5_btnElem_hyperLink" href="/reading-rm/sensitive-info.html" target="_self"><span id="mm53c3_CORE_V1_InPageLink5_btnElem_lblText">Withholding of Sensitive Information</span></a>
<a id="mm53c3_CORE_V1_InPageLink12_btnElem_hyperLink" href="/reading-rm/cui.html" target="_self"><span id="mm53c3_CORE_V1_InPageLink12_btnElem_lblText">Controlled Unclassified Information Program (CUI)</span></a>
</div></div></div><div class="container"><div class="row  inner-top-xs general-content  "><div class="col-md-12"><hr class="line dashed-line-brand-color-yellow"/><a id="mm51c1_CORE_V1_InPageLink13_btnElem_hyperLink" class="quick-link" href="/about-nrc/regulatory/adjudicatory.html#ehd" target="_self"><span id="mm51c1_CORE_V1_InPageLink13_btnElem_lblText">Electronic Hearing Docket</span></a>
</div></div></div></div>
</li>
</ul>
</li><li class="dropdown yamm-fullwidth">
  <a href="/about-nrc.html" class="dropdown-toggle">About NRC</a>
  <a class="angle top-level" data-toggle="dropdown" href="#"></a>
  <ul class="dropdown-menu yamm-dropdown-menu">
    <li>
      <div class="yamm-content">
<div class="container"><div class="row inner-top-xs general-content  "><div class="mb-pd-btm col-sm-4"><a id="mm63c1_CORE_V1_InPageLink_btnElem_hyperLink" href="/about-nrc/organization/commfuncdesc.html" target="_self"><span id="mm63c1_CORE_V1_InPageLink_btnElem_lblText">The Commission</span></a>
<a id="mm63c1_CORE_V1_InPageLink1_btnElem_hyperLink" href="/about-nrc/organization.html" target="_self"><span id="mm63c1_CORE_V1_InPageLink1_btnElem_lblText">Organization &amp; Functions</span></a>
<a id="mm63c1_CORE_V1_InPageLink6_btnElem_hyperLink" href="/about-nrc/governing-laws.html" target="_self"><span id="mm63c1_CORE_V1_InPageLink6_btnElem_lblText">Governing Legislation</span></a>
<a id="mm63c1_CORE_V1_InPageLink7_btnElem_hyperLink" href="/about-nrc/plans-performance.html" target="_self"><span id="mm63c1_CORE_V1_InPageLink7_btnElem_lblText">Plans, Budget, &amp; Performance</span></a>
<a id="mm63c1_CORE_V1_InPageLink8_btnElem_hyperLink" href="/about-nrc/locations.html" target="_self"><span id="mm63c1_CORE_V1_InPageLink8_btnElem_lblText">Locations</span></a>
<a id="mm63c1_CORE_V1_InPageLink9_btnElem_hyperLink" href="/about-nrc/history.html" target="_self"><span id="mm63c1_CORE_V1_InPageLink9_btnElem_lblText">History</span></a>
<a id="mm63c1_CORE_V1_InPageLink10_btnElem_hyperLink" href="/about-nrc/values.html" target="_self"><span id="mm63c1_CORE_V1_InPageLink10_btnElem_lblText">Values</span></a>
<a id="mm63c1_CORE_V1_InPageLink2_btnElem_hyperLink" href="/about-nrc/policymaking.html" target="_self"><span id="mm63c1_CORE_V1_InPageLink2_btnElem_lblText">Direction-Setting &amp; Policymaking</span></a>
<a id="mm63c1_CORE_V1_InPageLink3_btnElem_hyperLink" href="/about-nrc/regulatory/research.html" target="_self"><span id="mm63c1_CORE_V1_InPageLink3_btnElem_lblText">Research Activities</span></a>
<a id="mm63c1_CORE_V1_InPageLink11_btnElem_hyperLink" href="/about-nrc/radiation.html" target="_self"><span id="mm63c1_CORE_V1_InPageLink11_btnElem_lblText">Radiation Protection</span></a>
</div><div class="mb-pd-btm col-sm-4"><a id="mm63c2_CORE_V1_InPageLink12_btnElem_hyperLink" href="/about-nrc/fire-protection.html" target="_self"><span id="mm63c2_CORE_V1_InPageLink12_btnElem_lblText">Fire Protection</span></a>
<a id="mm63c2_CORE_V1_InPageLink13_btnElem_hyperLink" href="/about-nrc/safety-culture.html" target="_self"><span id="mm63c2_CORE_V1_InPageLink13_btnElem_lblText">Safety Culture</span></a>
<a id="mm63c2_CORE_V1_InPageLink14_btnElem_hyperLink" href="/about-nrc/regulatory.html" target="_self"><span id="mm63c2_CORE_V1_InPageLink14_btnElem_lblText">How We Regulate</span></a>
<a id="mm63c2_CORE_V1_InPageLink15_btnElem_hyperLink" href="/about-nrc/emerg-preparedness.html" target="_self"><span id="mm63c2_CORE_V1_InPageLink15_btnElem_lblText">Emergency Preparedness &amp; Response</span></a>
<a id="mm63c2_CORE_V1_InPageLink4_btnElem_hyperLink" href="/about-nrc/public-affairs.html" target="_self"><span id="mm63c2_CORE_V1_InPageLink4_btnElem_lblText">Public Affairs</span></a>
<a id="mm63c2_CORE_V1_InPageLink5_btnElem_hyperLink" href="/about-nrc/congress-affairs.html" target="_self"><span id="mm63c2_CORE_V1_InPageLink5_btnElem_lblText">Congressional Affairs</span></a>
<a id="mm63c2_CORE_V1_InPageLink16_btnElem_hyperLink" href="/about-nrc/regulatory/enforcement.html" target="_self"><span id="mm63c2_CORE_V1_InPageLink16_btnElem_lblText">Enforcement</span></a>
<a id="mm63c2_CORE_V1_InPageLink17_btnElem_hyperLink" href="/about-nrc/international.html" target="_self"><span id="mm63c2_CORE_V1_InPageLink17_btnElem_lblText">International Programs</span></a>
<a id="mm63c2_CORE_V1_InPageLink18_btnElem_hyperLink" href="/about-nrc/state-tribal.html" target="_self"><span id="mm63c2_CORE_V1_InPageLink18_btnElem_lblText">State &amp; Tribal Programs</span></a>
</div><div class="mb-pd-btm col-sm-4"><a id="mm63c3_CORE_V1_InPageLink19_btnElem_hyperLink" href="/about-nrc/alt-dispute-resolution.html" target="_self"><span id="mm63c3_CORE_V1_InPageLink19_btnElem_lblText">Alternative Dispute Resolution Programs</span></a>
<a id="mm63c3_CORE_V1_InPageLink20_btnElem_hyperLink" href="/privacy/index.html" target="_self"><span id="mm63c3_CORE_V1_InPageLink20_btnElem_lblText">Privacy Program</span></a>
<a id="mm63c3_CORE_V1_InPageLink21_btnElem_hyperLink" href="/about-nrc/civil-rights.html" target="_self"><span id="mm63c3_CORE_V1_InPageLink21_btnElem_lblText">Civil Rights Program</span></a>
<a id="mm63c3_CORE_V1_InPageLink22_btnElem_hyperLink" href="/about-nrc/contactus.html" target="_self"><span id="mm63c3_CORE_V1_InPageLink22_btnElem_lblText">Contact Us</span></a>
<a id="mm63c3_CORE_V1_InPageLink23_btnElem_hyperLink" href="/about-nrc/employment.html" target="_self"><span id="mm63c3_CORE_V1_InPageLink23_btnElem_lblText">Career Opportunities</span></a>
<a id="mm63c3_CORE_V1_InPageLink24_btnElem_hyperLink" href="/about-nrc/contracting.html" target="_self"><span id="mm63c3_CORE_V1_InPageLink24_btnElem_lblText">Contracting Opportunities</span></a>
<a id="mm63c3_CORE_V1_InPageLink25_btnElem_hyperLink" href="/about-nrc/contracting/small-business.html" target="_self"><span id="mm63c3_CORE_V1_InPageLink25_btnElem_lblText">Small Businesses</span></a>
<a id="mm63c3_CORE_V1_InPageLink26_btnElem_hyperLink" href="/about-nrc/grants.html" target="_self"><span id="mm63c3_CORE_V1_InPageLink26_btnElem_lblText">Grant Opportunities</span></a>
<a id="mm63c3_CORE_V1_InPageLink27_btnElem_hyperLink" href="/about-nrc/generic-schedules.html" target="_self"><span id="mm63c3_CORE_V1_InPageLink27_btnElem_lblText">Generic Schedules</span></a>
</div></div></div></div>
</li>
</ul>
</li><li class="dropdown yamm-fullwidth show-menu-for-mobile">
  <a href="/other-links.html" class="dropdown-toggle">Other Links</a>
  <a class="angle top-level" data-toggle="dropdown" href="#"></a>
  <ul class="dropdown-menu yamm-dropdown-menu">
    <li>
      <div class="yamm-content">



<!-- Content -->
<div class="container inner-top-xs">
  <div class="row">
    <div class="col-sm-12 general-content link-page">
      
      <div class="container"><div class="row inner-top-xs general-content  "><div class="mb-pd-btm col-sm-4"><a id="mmm33c1_CORE_V1_InPageLink15_btnElem_hyperLink" href="/reading-rm/faqlist.html" target="_self"><span id="mmm33c1_CORE_V1_InPageLink15_btnElem_lblText">FAQ</span></a>
<a id="mmm33c1_CORE_V1_InPageLink16_btnElem_hyperLink" href="/reading-rm/basic-ref/glossary.html" target="_self"><span id="mmm33c1_CORE_V1_InPageLink16_btnElem_lblText">Glossary</span></a>
<a id="mmm33c1_CORE_V1_InPageLink17_btnElem_hyperLink" href="/info-finder.html" target="_self"><span id="mmm33c1_CORE_V1_InPageLink17_btnElem_lblText">Facility Locator</span></a>
<a id="mmm33c1_CORE_V1_InPageLink18_btnElem_hyperLink" href="/site-help/new-content.html" target="_self"><span id="mmm33c1_CORE_V1_InPageLink18_btnElem_lblText">What&#39;s New</span></a>
</div><div class="mb-pd-btm col-sm-4"><a id="mmm33c2_CORE_V1_InPageLink19_btnElem_hyperLink" href="/site-help.html" target="_self"><span id="mmm33c2_CORE_V1_InPageLink19_btnElem_lblText">Site Help</span></a>
<a id="mmm33c2_CORE_V1_InPageLink20_btnElem_hyperLink" href="/site-help/index-az.html" target="_self"><span id="mmm33c2_CORE_V1_InPageLink20_btnElem_lblText">Index A-Z</span></a>
<a id="mmm33c2_CORE_V1_InPageLink21_btnElem_hyperLink" href="/about-nrc/contactus.html" target="_self"><span id="mmm33c2_CORE_V1_InPageLink21_btnElem_lblText">Contact Us</span></a>
<a id="mmm33c2_CORE_V1_InPageLink22_btnElem_hyperLink" href="/public-involve/listserver.html" target="_self"><span id="mmm33c2_CORE_V1_InPageLink22_btnElem_lblText">Email Updates</span></a>
</div><div class="mb-pd-btm col-sm-4"><a id="mmm33c3_CORE_V1_InPageLink23_btnElem_hyperLink" class="other" href="https://www.facebook.com/nrcgov/" target="_blank"><span id="mmm33c3_CORE_V1_InPageLink23_btnElem_lblText">NRC Facebook</span></a>
<a id="mmm33c3_CORE_V1_InPageLink24_btnElem_hyperLink" class="other" href="https://www.twitter.com/nrcgov" target="_blank"><span id="mmm33c3_CORE_V1_InPageLink24_btnElem_lblText">NRC Twitter Feed</span></a>
<a id="mmm33c3_CORE_V1_InPageLink25_btnElem_hyperLink" class="other" href="https://www.linkedin.com/company/u-s--nuclear-regulatory-commission/" target="_blank"><span id="mmm33c3_CORE_V1_InPageLink25_btnElem_lblText">NRC Linkedin</span></a>
<a id="mmm33c3_CORE_V1_InPageLink26_btnElem_hyperLink" class="other" href="https://www.youtube.com/user/NRCgov" target="_blank"><span id="mmm33c3_CORE_V1_InPageLink26_btnElem_lblText">NRC Youtube Channel</span></a>
<a id="mmm33c3_CORE_V1_InPageLink27_btnElem_hyperLink" class="other" href="https://www.flickr.com/photos/nrcgov/sets" target="_blank"><span id="mmm33c3_CORE_V1_InPageLink27_btnElem_lblText">NRC Flickr Gallery</span></a>
<a id="mmm33c3_CORE_V1_InPageLink28_btnElem_hyperLink" class="other" href="https://public-blog.nrc-gateway.gov/" target="_blank"><span id="mmm33c3_CORE_V1_InPageLink28_btnElem_lblText">NRC Blog Archived</span></a>
<a id="mmm33c3_CORE_V1_InPageLink29_btnElem_hyperLink" class="other" href="https://service.govdelivery.com/service/multi_subscribe.html?code=USNRC" target="_blank"><span id="mmm33c3_CORE_V1_InPageLink29_btnElem_lblText">NRC Email Subscriptions - GovDelivery</span></a>
</div></div></div>
      
    </div>
  </div>
</div></div>
</li>
</ul>
</li>
            </ul>
            <!-- End Main Navigation -->
          </div>
        </div>
      </div>
      <!-- End Main Navigation, Desktop Logo, and Search Dropdown -->
    </div>
  </header>
  <!-- End Header -->
  
  <!-- Begin Content -->
  <main>
    
<section id="hero" class="content-width-hero-slider primary-background height-sm">
  <div class="container">
    <div id="owl-main" class="owl-carousel height-sm owl-inner-nav owl-ui-lg">
<div class="item heroBackground-59 img-bg img-bg-soft">
  <span role='img' aria-label='a light orange background, over a silhouette image of a city park with dark orange trees, a park bench and people walking, shown participating in activities, i.e., a person walking a dog, a family - parents and child walking together, and a person feeding birds; the trees in the foreground are dark orange silhouettes.'></span>
  <style type="text/css">
    .heroBackground-59 {
      background: url(/images/homepage/autumn-season-mobile.jpg);
      background-repeat: no-repeat !important;
    }
    
    @media only screen and (min-width: 62.5em) {
      .heroBackground-59 {
        background: url(/images/homepage/autumn-season.jpg);
      }
    }
  </style>
  <div class="container">
    <div class="caption vertical-center text-center">
      <h1 class="fadeInDown-1 white">PROTECTING PEOPLE AND <br /> THE ENVIRONMENT </h1>
      
      <div class="fadeInDown-3">
        <a href='/about-nrc/radiation/protects-you.html#142873' class='btn btn-medium primary-background'>Learn More</a>
      </div>
    </div>
  </div>
</div>
<div class="item heroBackground-306 img-bg img-bg-soft">
  <span role='img' aria-label='Graphic shows an artistic rendering of an abstract rainbow figure with text pointing out NRC RIC 2024 conference details including dates of March 12-14, 2024, and location for the in-person portion, the Bethesda North Marriott Hotel and Conference Center, Rockville, Maryland.'></span>
  <style type="text/css">
    .heroBackground-306 {
      background: url(/images/homepage/ric-save-the-date-mobile.jpg);
      background-repeat: no-repeat !important;
    }
    
    @media only screen and (min-width: 62.5em) {
      .heroBackground-306 {
        background: url(/images/homepage/ric-save-the-date.jpg);
      }
    }
  </style>
  <div class="container">
    <div class="caption vertical-center text-center">
      <h1 class="fadeInDown-1 black"></h1>
      
      <div class="fadeInDown-3">
        <a href='/homepage/features.html#147481' class='btn btn-medium primary-background'>Learn More</a>
      </div>
    </div>
  </div>
</div>
<div class="item heroBackground-304 img-bg img-bg-soft">
  <span role='img' aria-label='NRC Chair Christopher Hanson, left, and Luis Huerta Torchio, executive director of the Nuclear Energy Commission of Chile, celebrate the signing of a new bilateral regulatory partnership during the IAEA General Conference in Vienna, Austria.'></span>
  <style type="text/css">
    .heroBackground-304 {
      background: url(/images/homepage/homepage-09292023-mobile.jpg);
      background-repeat: no-repeat !important;
    }
    
    @media only screen and (min-width: 62.5em) {
      .heroBackground-304 {
        background: url(/images/homepage/homepage-09292023.jpg);
      }
    }
  </style>
  <div class="container">
    <div class="caption vertical-center text-center">
      <h1 class="fadeInDown-1 black"></h1>
      
      <div class="fadeInDown-3">
        <a href='/homepage/features.html#147472' class='btn btn-medium primary-background'>Learn More</a>
      </div>
    </div>
  </div>
</div>
<div class="item heroBackground-307 img-bg img-bg-soft">
  <span role='img' aria-label='Image depicts three individuals at a table with two at the ends listening to center person discussing a topic using hand gestures. '></span>
  <style type="text/css">
    .heroBackground-307 {
      background: url(/images/homepage/homepage-09262023-mobile.jpg);
      background-repeat: no-repeat !important;
    }
    
    @media only screen and (min-width: 62.5em) {
      .heroBackground-307 {
        background: url(/images/homepage/homepage-09262023.jpg);
      }
    }
  </style>
  <div class="container">
    <div class="caption vertical-center text-center">
      <h1 class="fadeInDown-1 black"></h1>
      
      <div class="fadeInDown-3">
        <a href='/homepage/features.html#147499' class='btn btn-medium primary-background'>Learn More</a>
      </div>
    </div>
  </div>
</div>
<div class="item heroBackground-300 img-bg img-bg-soft">
  <span role='img' aria-label='NRC inspectors Eric Magnuson and Casey Smith, left, and Emma Haywood and Evan Robinson, right, perform a dye liquid penetrate test during a non-destructive testing course in Portland, Oregon, where they honed their skills to help in the verification process to ensure safety and structural integrity. Present but not pictured, NRC Inspectors Nate Mentzer and Devendra Ray.'></span>
  <style type="text/css">
    .heroBackground-300 {
      background: url(/images/homepage/homepage-09252023-mobile.jpg);
      background-repeat: no-repeat !important;
    }
    
    @media only screen and (min-width: 62.5em) {
      .heroBackground-300 {
        background: url(/images/homepage/homepage-09252023.jpg);
      }
    }
  </style>
  <div class="container">
    <div class="caption vertical-center text-center">
      <h1 class="fadeInDown-1 black"></h1>
      
      <div class="fadeInDown-3">
        <a href='/homepage/features.html#147451' class='btn btn-medium primary-background'>Learn More</a>
      </div>
    </div>
  </div>
</div>
<div class="item heroBackground-286 img-bg img-bg-soft">
  <span role='img' aria-label='NRC Commissioner Bradley Crowell, center, pauses for a photo during a tour of the decommissioning San Onofre Nuclear Station, in California, with Congressman Mike Levin, third from right, and Region IV Administrator John Monninger, second from left, along with other NRC staff and an official from Southern California Edison. Photo courtesy of SCE.'></span>
  <style type="text/css">
    .heroBackground-286 {
      background: url(/images/homepage/homepage-09142023-mobile.jpg);
      background-repeat: no-repeat !important;
    }
    
    @media only screen and (min-width: 62.5em) {
      .heroBackground-286 {
        background: url(/images/homepage/homepage-09142023.jpg);
      }
    }
  </style>
  <div class="container">
    <div class="caption vertical-center text-center">
      <h1 class="fadeInDown-1 black"></h1>
      
      <div class="fadeInDown-3">
        <a href='/homepage/features.html#147171' class='btn btn-medium primary-background'>Learn More</a>
      </div>
    </div>
  </div>
</div>
<div class="item heroBackground-303 img-bg img-bg-soft">
  <span role='img' aria-label='Commissioner Annie Caputo works with students during an OECD/Nuclear Energy Agencyâ€™s International Mentoring Workshop in Korea.'></span>
  <style type="text/css">
    .heroBackground-303 {
      background: url(/images/homepage/homepage-09122023-mobile.jpg);
      background-repeat: no-repeat !important;
    }
    
    @media only screen and (min-width: 62.5em) {
      .heroBackground-303 {
        background: url(/images/homepage/homepage-09122023.jpg);
      }
    }
  </style>
  <div class="container">
    <div class="caption vertical-center text-center">
      <h1 class="fadeInDown-1 black"></h1>
      
      <div class="fadeInDown-3">
        <a href='/homepage/features.html#147471' class='btn btn-medium primary-background'>Learn More</a>
      </div>
    </div>
  </div>
</div>

</div>
</div>
</section>
<div class="container inner-top-xs">
  <div class="row">
    <div class="col-md-4">
      <h3 class='text-left white primary-background-heading' >Spotlight</h3>
      <div class="sidenav list home">
<ul >
<li><a href="/about-nrc/organization/commfuncdesc.html" target="_self">The Commission</a></li><li><a href="/reactors/operating/licensing/renewal/sled.html" target="_self">License Renewal Generic Environmental Review</a></li><li><a href="https://www.usajobs.gov/Search/Results?a=NU00" target="_self">Job Openings</a></li><li><a href="/about-nrc/regulatory/licensing/nepa/environmental-justice/assessment.html" target="_self">Environmental Justice </a></li><li><a href="/info-finder/reactors/pilg/faq-discharge.html" target="_self">Pilgrim Water Releases</a></li><li><a href="/info-finder/reactors/mont/tritium-and-effluent-release-issue.html#response" target="_self">Monticello Tritium Issue</a></li><li><a href="/about-nrc/international.html" target="_self">International Strategy 2021-2025</a></li><li><a href="https://tribal.nrc.gov/" target="_self">Tribal Liaison Program</a></li><li><a href="https://mapx.nrc-gateway.gov/" target="_self">MAP-X</a></li><li><a href="/about-nrc/plans-performance/modern-risk-informed-reg.html" target="_self">Transformation at the NRC - Updated</a></li><li><a href="https://nrcoig.oversight.gov/oig-hotline" target="_self">OIG Hotline</a></li><li><a href="/reading-rm/doc-collections/rulemaking-ruleforum/active/ruleindex.html" target="_self">Rulemaking Activity</a></li><li><a href="/reading-rm/doc-collections/commission/recent/index.html" target="_self">Commission Documents</a></li><li><a href="/reactors/new-reactors/advanced.html" target="_self">Advanced Reactors</a></li><li><a href="/security.html" target="_self">Nuclear Security</a></li>
</ul>
</div>
<div class="more" style="margin-bottom: 10px ;margin-top:-15px; text-align: center;">
  <a href="/past-key-topics.html">Spotlight Archive Â»</a>
</div>
    </div>
    <div class="col-md-4">
      <h3 class='text-left white primary-background-heading' >Latest News</h3>
      <div class="articles">
<div class="articles-list">
  <a href="/cdn/doc-collection-news/2023/23-012-i.pdf" target="_blank">
    <i class="icon-fontello-doc-1">&nbsp;</i> 
    <span>NRC to Conduct Predecisional Enforcement Conference with West Virginia Hospital to Discuss Proposed Violations</span> 
  </a>
</div>
<div class="articles-list">
  <a href="/cdn/doc-collection-news/2023/23-064.pdf" target="_blank">
    <i class="icon-fontello-doc-1">&nbsp;</i> 
    <span>NRC to Hold Public Meetings on Preliminary Regulatory Development for Fusion Systems</span> 
  </a>
</div>
<div class="articles-list">
  <a href="/cdn/doc-collection-news/2023/23-063.pdf" target="_blank">
    <i class="icon-fontello-doc-1">&nbsp;</i> 
    <span>NRC Announces Hearing Opportunity on Carbon Free Power Projectâ€™s Limited Work Authorization Application</span> 
  </a>
</div>
<div class="articles-list">
  <a href="/cdn/doc-collection-news/2023/23-062.pdf" target="_blank">
    <i class="icon-fontello-doc-1">&nbsp;</i> 
    <span>NRC Approves License Transfers for Energy Harbor Nuclear Plants</span> 
  </a>
</div>
<div class="articles-list">
  <a href="/cdn/doc-collection-news/2023/23-061.pdf" target="_blank">
    <i class="icon-fontello-doc-1">&nbsp;</i> 
    <span>NRC Announces Hearing Opportunity for Perry License Renewal; Public Meetings in October to Discuss Environmental Review</span> 
  </a>
</div>
<div class="articles-list">
  <a href="/cdn/doc-collection-news/2023/23-029-ii.pdf" target="_blank">
    <i class="icon-fontello-doc-1">&nbsp;</i> 
    <span>NRC Names New Senior Resident Inspector at Hatch Nuclear Plant</span> 
  </a>
</div>

<div class="articles-list-button"><a href="/reading-rm/doc-collections/news/2023/index.html" class="btn">View All</a></div>
</div>

    </div>
    <div class="col-md-4">
      <h3 class='text-left white primary-background-heading' >Public Meetings</h3><div class='text-center'><div align="left" style="border:thin solid;"><i class="icon-fontello-signal" style="float: left;font-size: 1.75em;">&nbsp;</i> <a href="https://video.nrc.gov/">Next Commission Webcast</a><br />
<strong>[October 19,&nbsp;2023&nbsp;at 9:00&nbsp;a.m. (EDT)]</strong></div>
</div>
      <div id="calendar" class="pmc"></div>
<script type="text/javascript">
  
  var calendardata = {
    editable: false,
    eventLimit: true,
    showNonCurrentDates: false,
    fixedWeekCount: false,
    eventRender: function(event, element) {
      makeTodaybtnActive();
    },
    events: [
      {
title: '04',
url: 'https://www.nrc.gov/pmns/mtg?do=search.results&pageno=1&StartDate=7/04/2023&EndDate=7/04/2023',
start: '2023-07-04'
},{
title: '05',
url: 'https://www.nrc.gov/pmns/mtg?do=search.results&pageno=1&StartDate=7/05/2023&EndDate=7/05/2023',
start: '2023-07-05'
},{
title: '06',
url: 'https://www.nrc.gov/pmns/mtg?do=search.results&pageno=1&StartDate=7/06/2023&EndDate=7/06/2023',
start: '2023-07-06'
},{
title: '07',
url: 'https://www.nrc.gov/pmns/mtg?do=search.results&pageno=1&StartDate=7/07/2023&EndDate=7/07/2023',
start: '2023-07-07'
},{
title: '08',
url: 'https://www.nrc.gov/pmns/mtg?do=search.results&pageno=1&StartDate=7/08/2023&EndDate=7/08/2023',
start: '2023-07-08'
},{
title: '09',
url: 'https://www.nrc.gov/pmns/mtg?do=search.results&pageno=1&StartDate=7/09/2023&EndDate=7/09/2023',
start: '2023-07-09'
},{
title: '10',
url: 'https://www.nrc.gov/pmns/mtg?do=search.results&pageno=1&StartDate=7/10/2023&EndDate=7/10/2023',
start: '2023-07-10'
},{
title: '11',
url: 'https://www.nrc.gov/pmns/mtg?do=search.results&pageno=1&StartDate=7/11/2023&EndDate=7/11/2023',
start: '2023-07-11'
},{
title: '12',
url: 'https://www.nrc.gov/pmns/mtg?do=search.results&pageno=1&StartDate=7/12/2023&EndDate=7/12/2023',
start: '2023-07-12'
},{
title: '13',
url: 'https://www.nrc.gov/pmns/mtg?do=search.results&pageno=1&StartDate=7/13/2023&EndDate=7/13/2023',
start: '2023-07-13'
},{
title: '14',
url: 'https://www.nrc.gov/pmns/mtg?do=search.results&pageno=1&StartDate=7/14/2023&EndDate=7/14/2023',
start: '2023-07-14'
},{
title: '15',
url: 'https://www.nrc.gov/pmns/mtg?do=search.results&pageno=1&StartDate=7/15/2023&EndDate=7/15/2023',
start: '2023-07-15'
},{
title: '16',
url: 'https://www.nrc.gov/pmns/mtg?do=search.results&pageno=1&StartDate=7/16/2023&EndDate=7/16/2023',
start: '2023-07-16'
},{
title: '17',
url: 'https://www.nrc.gov/pmns/mtg?do=search.results&pageno=1&StartDate=7/17/2023&EndDate=7/17/2023',
start: '2023-07-17'
},{
title: '18',
url: 'https://www.nrc.gov/pmns/mtg?do=search.results&pageno=1&StartDate=7/18/2023&EndDate=7/18/2023',
start: '2023-07-18'
},{
title: '19',
url: 'https://www.nrc.gov/pmns/mtg?do=search.results&pageno=1&StartDate=7/19/2023&EndDate=7/19/2023',
start: '2023-07-19'
},{
title: '20',
url: 'https://www.nrc.gov/pmns/mtg?do=search.results&pageno=1&StartDate=7/20/2023&EndDate=7/20/2023',
start: '2023-07-20'
},{
title: '21',
url: 'https://www.nrc.gov/pmns/mtg?do=search.results&pageno=1&StartDate=7/21/2023&EndDate=7/21/2023',
start: '2023-07-21'
},{
title: '22',
url: 'https://www.nrc.gov/pmns/mtg?do=search.results&pageno=1&StartDate=7/22/2023&EndDate=7/22/2023',
start: '2023-07-22'
},{
title: '23',
url: 'https://www.nrc.gov/pmns/mtg?do=search.results&pageno=1&StartDate=7/23/2023&EndDate=7/23/2023',
start: '2023-07-23'
},{
title: '24',
url: 'https://www.nrc.gov/pmns/mtg?do=search.results&pageno=1&StartDate=7/24/2023&EndDate=7/24/2023',
start: '2023-07-24'
},{
title: '25',
url: 'https://www.nrc.gov/pmns/mtg?do=search.results&pageno=1&StartDate=7/25/2023&EndDate=7/25/2023',
start: '2023-07-25'
},{
title: '26',
url: 'https://www.nrc.gov/pmns/mtg?do=search.results&pageno=1&StartDate=7/26/2023&EndDate=7/26/2023',
start: '2023-07-26'
},{
title: '27',
url: 'https://www.nrc.gov/pmns/mtg?do=search.results&pageno=1&StartDate=7/27/2023&EndDate=7/27/2023',
start: '2023-07-27'
},{
title: '28',
url: 'https://www.nrc.gov/pmns/mtg?do=search.results&pageno=1&StartDate=7/28/2023&EndDate=7/28/2023',
start: '2023-07-28'
},{
title: '29',
url: 'https://www.nrc.gov/pmns/mtg?do=search.results&pageno=1&StartDate=7/29/2023&EndDate=7/29/2023',
start: '2023-07-29'
},{
title: '30',
url: 'https://www.nrc.gov/pmns/mtg?do=search.results&pageno=1&StartDate=7/30/2023&EndDate=7/30/2023',
start: '2023-07-30'
},{
title: '31',
url: 'https://www.nrc.gov/pmns/mtg?do=search.results&pageno=1&StartDate=7/31/2023&EndDate=7/31/2023',
start: '2023-07-31'
},{
title: '01',
url: 'https://www.nrc.gov/pmns/mtg?do=search.results&pageno=1&StartDate=8/01/2023&EndDate=8/01/2023',
start: '2023-08-01'
},{
title: '02',
url: 'https://www.nrc.gov/pmns/mtg?do=search.results&pageno=1&StartDate=8/02/2023&EndDate=8/02/2023',
start: '2023-08-02'
},{
title: '03',
url: 'https://www.nrc.gov/pmns/mtg?do=search.results&pageno=1&StartDate=8/03/2023&EndDate=8/03/2023',
start: '2023-08-03'
},{
title: '04',
url: 'https://www.nrc.gov/pmns/mtg?do=search.results&pageno=1&StartDate=8/04/2023&EndDate=8/04/2023',
start: '2023-08-04'
},{
title: '05',
url: 'https://www.nrc.gov/pmns/mtg?do=search.results&pageno=1&StartDate=8/05/2023&EndDate=8/05/2023',
start: '2023-08-05'
},{
title: '06',
url: 'https://www.nrc.gov/pmns/mtg?do=search.results&pageno=1&StartDate=8/06/2023&EndDate=8/06/2023',
start: '2023-08-06'
},{
title: '07',
url: 'https://www.nrc.gov/pmns/mtg?do=search.results&pageno=1&StartDate=8/07/2023&EndDate=8/07/2023',
start: '2023-08-07'
},{
title: '08',
url: 'https://www.nrc.gov/pmns/mtg?do=search.results&pageno=1&StartDate=8/08/2023&EndDate=8/08/2023',
start: '2023-08-08'
},{
title: '09',
url: 'https://www.nrc.gov/pmns/mtg?do=search.results&pageno=1&StartDate=8/09/2023&EndDate=8/09/2023',
start: '2023-08-09'
},{
title: '10',
url: 'https://www.nrc.gov/pmns/mtg?do=search.results&pageno=1&StartDate=8/10/2023&EndDate=8/10/2023',
start: '2023-08-10'
},{
title: '11',
url: 'https://www.nrc.gov/pmns/mtg?do=search.results&pageno=1&StartDate=8/11/2023&EndDate=8/11/2023',
start: '2023-08-11'
},{
title: '12',
url: 'https://www.nrc.gov/pmns/mtg?do=search.results&pageno=1&StartDate=8/12/2023&EndDate=8/12/2023',
start: '2023-08-12'
},{
title: '13',
url: 'https://www.nrc.gov/pmns/mtg?do=search.results&pageno=1&StartDate=8/13/2023&EndDate=8/13/2023',
start: '2023-08-13'
},{
title: '14',
url: 'https://www.nrc.gov/pmns/mtg?do=search.results&pageno=1&StartDate=8/14/2023&EndDate=8/14/2023',
start: '2023-08-14'
},{
title: '15',
url: 'https://www.nrc.gov/pmns/mtg?do=search.results&pageno=1&StartDate=8/15/2023&EndDate=8/15/2023',
start: '2023-08-15'
},{
title: '16',
url: 'https://www.nrc.gov/pmns/mtg?do=search.results&pageno=1&StartDate=8/16/2023&EndDate=8/16/2023',
start: '2023-08-16'
},{
title: '17',
url: 'https://www.nrc.gov/pmns/mtg?do=search.results&pageno=1&StartDate=8/17/2023&EndDate=8/17/2023',
start: '2023-08-17'
},{
title: '18',
url: 'https://www.nrc.gov/pmns/mtg?do=search.results&pageno=1&StartDate=8/18/2023&EndDate=8/18/2023',
start: '2023-08-18'
},{
title: '19',
url: 'https://www.nrc.gov/pmns/mtg?do=search.results&pageno=1&StartDate=8/19/2023&EndDate=8/19/2023',
start: '2023-08-19'
},{
title: '20',
url: 'https://www.nrc.gov/pmns/mtg?do=search.results&pageno=1&StartDate=8/20/2023&EndDate=8/20/2023',
start: '2023-08-20'
},{
title: '21',
url: 'https://www.nrc.gov/pmns/mtg?do=search.results&pageno=1&StartDate=8/21/2023&EndDate=8/21/2023',
start: '2023-08-21'
},{
title: '22',
url: 'https://www.nrc.gov/pmns/mtg?do=search.results&pageno=1&StartDate=8/22/2023&EndDate=8/22/2023',
start: '2023-08-22'
},{
title: '23',
url: 'https://www.nrc.gov/pmns/mtg?do=search.results&pageno=1&StartDate=8/23/2023&EndDate=8/23/2023',
start: '2023-08-23'
},{
title: '24',
url: 'https://www.nrc.gov/pmns/mtg?do=search.results&pageno=1&StartDate=8/24/2023&EndDate=8/24/2023',
start: '2023-08-24'
},{
title: '25',
url: 'https://www.nrc.gov/pmns/mtg?do=search.results&pageno=1&StartDate=8/25/2023&EndDate=8/25/2023',
start: '2023-08-25'
},{
title: '26',
url: 'https://www.nrc.gov/pmns/mtg?do=search.results&pageno=1&StartDate=8/26/2023&EndDate=8/26/2023',
start: '2023-08-26'
},{
title: '27',
url: 'https://www.nrc.gov/pmns/mtg?do=search.results&pageno=1&StartDate=8/27/2023&EndDate=8/27/2023',
start: '2023-08-27'
},{
title: '28',
url: 'https://www.nrc.gov/pmns/mtg?do=search.results&pageno=1&StartDate=8/28/2023&EndDate=8/28/2023',
start: '2023-08-28'
},{
title: '29',
url: 'https://www.nrc.gov/pmns/mtg?do=search.results&pageno=1&StartDate=8/29/2023&EndDate=8/29/2023',
start: '2023-08-29'
},{
title: '30',
url: 'https://www.nrc.gov/pmns/mtg?do=search.results&pageno=1&StartDate=8/30/2023&EndDate=8/30/2023',
start: '2023-08-30'
},{
title: '31',
url: 'https://www.nrc.gov/pmns/mtg?do=search.results&pageno=1&StartDate=8/31/2023&EndDate=8/31/2023',
start: '2023-08-31'
},{
title: '01',
url: 'https://www.nrc.gov/pmns/mtg?do=search.results&pageno=1&StartDate=9/01/2023&EndDate=9/01/2023',
start: '2023-09-01'
},{
title: '02',
url: 'https://www.nrc.gov/pmns/mtg?do=search.results&pageno=1&StartDate=9/02/2023&EndDate=9/02/2023',
start: '2023-09-02'
},{
title: '03',
url: 'https://www.nrc.gov/pmns/mtg?do=search.results&pageno=1&StartDate=9/03/2023&EndDate=9/03/2023',
start: '2023-09-03'
},{
title: '04',
url: 'https://www.nrc.gov/pmns/mtg?do=search.results&pageno=1&StartDate=9/04/2023&EndDate=9/04/2023',
start: '2023-09-04'
},{
title: '05',
url: 'https://www.nrc.gov/pmns/mtg?do=search.results&pageno=1&StartDate=9/05/2023&EndDate=9/05/2023',
start: '2023-09-05'
},{
title: '06',
url: 'https://www.nrc.gov/pmns/mtg?do=search.results&pageno=1&StartDate=9/06/2023&EndDate=9/06/2023',
start: '2023-09-06'
},{
title: '07',
url: 'https://www.nrc.gov/pmns/mtg?do=search.results&pageno=1&StartDate=9/07/2023&EndDate=9/07/2023',
start: '2023-09-07'
},{
title: '08',
url: 'https://www.nrc.gov/pmns/mtg?do=search.results&pageno=1&StartDate=9/08/2023&EndDate=9/08/2023',
start: '2023-09-08'
},{
title: '09',
url: 'https://www.nrc.gov/pmns/mtg?do=search.results&pageno=1&StartDate=9/09/2023&EndDate=9/09/2023',
start: '2023-09-09'
},{
title: '10',
url: 'https://www.nrc.gov/pmns/mtg?do=search.results&pageno=1&StartDate=9/10/2023&EndDate=9/10/2023',
start: '2023-09-10'
},{
title: '11',
url: 'https://www.nrc.gov/pmns/mtg?do=search.results&pageno=1&StartDate=9/11/2023&EndDate=9/11/2023',
start: '2023-09-11'
},{
title: '12',
url: 'https://www.nrc.gov/pmns/mtg?do=search.results&pageno=1&StartDate=9/12/2023&EndDate=9/12/2023',
start: '2023-09-12'
},{
title: '13',
url: 'https://www.nrc.gov/pmns/mtg?do=search.results&pageno=1&StartDate=9/13/2023&EndDate=9/13/2023',
start: '2023-09-13'
},{
title: '14',
url: 'https://www.nrc.gov/pmns/mtg?do=search.results&pageno=1&StartDate=9/14/2023&EndDate=9/14/2023',
start: '2023-09-14'
},{
title: '15',
url: 'https://www.nrc.gov/pmns/mtg?do=search.results&pageno=1&StartDate=9/15/2023&EndDate=9/15/2023',
start: '2023-09-15'
},{
title: '16',
url: 'https://www.nrc.gov/pmns/mtg?do=search.results&pageno=1&StartDate=9/16/2023&EndDate=9/16/2023',
start: '2023-09-16'
},{
title: '17',
url: 'https://www.nrc.gov/pmns/mtg?do=search.results&pageno=1&StartDate=9/17/2023&EndDate=9/17/2023',
start: '2023-09-17'
},{
title: '18',
url: 'https://www.nrc.gov/pmns/mtg?do=search.results&pageno=1&StartDate=9/18/2023&EndDate=9/18/2023',
start: '2023-09-18'
},{
title: '19',
url: 'https://www.nrc.gov/pmns/mtg?do=search.results&pageno=1&StartDate=9/19/2023&EndDate=9/19/2023',
start: '2023-09-19'
},{
title: '20',
url: 'https://www.nrc.gov/pmns/mtg?do=search.results&pageno=1&StartDate=9/20/2023&EndDate=9/20/2023',
start: '2023-09-20'
},{
title: '21',
url: 'https://www.nrc.gov/pmns/mtg?do=search.results&pageno=1&StartDate=9/21/2023&EndDate=9/21/2023',
start: '2023-09-21'
},{
title: '22',
url: 'https://www.nrc.gov/pmns/mtg?do=search.results&pageno=1&StartDate=9/22/2023&EndDate=9/22/2023',
start: '2023-09-22'
},{
title: '23',
url: 'https://www.nrc.gov/pmns/mtg?do=search.results&pageno=1&StartDate=9/23/2023&EndDate=9/23/2023',
start: '2023-09-23'
},{
title: '24',
url: 'https://www.nrc.gov/pmns/mtg?do=search.results&pageno=1&StartDate=9/24/2023&EndDate=9/24/2023',
start: '2023-09-24'
},{
title: '25',
url: 'https://www.nrc.gov/pmns/mtg?do=search.results&pageno=1&StartDate=9/25/2023&EndDate=9/25/2023',
start: '2023-09-25'
},{
title: '26',
url: 'https://www.nrc.gov/pmns/mtg?do=search.results&pageno=1&StartDate=9/26/2023&EndDate=9/26/2023',
start: '2023-09-26'
},{
title: '27',
url: 'https://www.nrc.gov/pmns/mtg?do=search.results&pageno=1&StartDate=9/27/2023&EndDate=9/27/2023',
start: '2023-09-27'
},{
title: '28',
url: 'https://www.nrc.gov/pmns/mtg?do=search.results&pageno=1&StartDate=9/28/2023&EndDate=9/28/2023',
start: '2023-09-28'
},{
title: '29',
url: 'https://www.nrc.gov/pmns/mtg?do=search.results&pageno=1&StartDate=9/29/2023&EndDate=9/29/2023',
start: '2023-09-29'
},{
title: '30',
url: 'https://www.nrc.gov/pmns/mtg?do=search.results&pageno=1&StartDate=9/30/2023&EndDate=9/30/2023',
start: '2023-09-30'
},{
title: '01',
url: 'https://www.nrc.gov/pmns/mtg?do=search.results&pageno=1&StartDate=10/01/2023&EndDate=10/01/2023',
start: '2023-10-01'
},{
title: '02',
url: 'https://www.nrc.gov/pmns/mtg?do=search.results&pageno=1&StartDate=10/02/2023&EndDate=10/02/2023',
start: '2023-10-02'
},{
title: '03',
url: 'https://www.nrc.gov/pmns/mtg?do=search.results&pageno=1&StartDate=10/03/2023&EndDate=10/03/2023',
start: '2023-10-03'
},{
title: '04',
url: 'https://www.nrc.gov/pmns/mtg?do=search.results&pageno=1&StartDate=10/04/2023&EndDate=10/04/2023',
start: '2023-10-04'
},{
title: '05',
url: 'https://www.nrc.gov/pmns/mtg?do=search.results&pageno=1&StartDate=10/05/2023&EndDate=10/05/2023',
start: '2023-10-05'
},{
title: '06',
url: 'https://www.nrc.gov/pmns/mtg?do=search.results&pageno=1&StartDate=10/06/2023&EndDate=10/06/2023',
start: '2023-10-06'
},{
title: '07',
url: 'https://www.nrc.gov/pmns/mtg?do=search.results&pageno=1&StartDate=10/07/2023&EndDate=10/07/2023',
start: '2023-10-07'
},{
title: '08',
url: 'https://www.nrc.gov/pmns/mtg?do=search.results&pageno=1&StartDate=10/08/2023&EndDate=10/08/2023',
start: '2023-10-08'
},{
title: '09',
url: 'https://www.nrc.gov/pmns/mtg?do=search.results&pageno=1&StartDate=10/09/2023&EndDate=10/09/2023',
start: '2023-10-09'
},{
title: '10',
url: 'https://www.nrc.gov/pmns/mtg?do=search.results&pageno=1&StartDate=10/10/2023&EndDate=10/10/2023',
start: '2023-10-10'
},{
title: '11',
url: 'https://www.nrc.gov/pmns/mtg?do=search.results&pageno=1&StartDate=10/11/2023&EndDate=10/11/2023',
start: '2023-10-11'
},{
title: '12',
url: 'https://www.nrc.gov/pmns/mtg?do=search.results&pageno=1&StartDate=10/12/2023&EndDate=10/12/2023',
start: '2023-10-12'
},{
title: '13',
url: 'https://www.nrc.gov/pmns/mtg?do=search.results&pageno=1&StartDate=10/13/2023&EndDate=10/13/2023',
start: '2023-10-13'
},{
title: '14',
url: 'https://www.nrc.gov/pmns/mtg?do=search.results&pageno=1&StartDate=10/14/2023&EndDate=10/14/2023',
start: '2023-10-14'
},{
title: '15',
url: 'https://www.nrc.gov/pmns/mtg?do=search.results&pageno=1&StartDate=10/15/2023&EndDate=10/15/2023',
start: '2023-10-15'
},{
title: '16',
url: 'https://www.nrc.gov/pmns/mtg?do=search.results&pageno=1&StartDate=10/16/2023&EndDate=10/16/2023',
start: '2023-10-16'
},{
title: '17',
url: 'https://www.nrc.gov/pmns/mtg?do=search.results&pageno=1&StartDate=10/17/2023&EndDate=10/17/2023',
start: '2023-10-17'
},{
title: '18',
url: 'https://www.nrc.gov/pmns/mtg?do=search.results&pageno=1&StartDate=10/18/2023&EndDate=10/18/2023',
start: '2023-10-18'
},{
title: '19',
url: 'https://www.nrc.gov/pmns/mtg?do=search.results&pageno=1&StartDate=10/19/2023&EndDate=10/19/2023',
start: '2023-10-19'
},{
title: '20',
url: 'https://www.nrc.gov/pmns/mtg?do=search.results&pageno=1&StartDate=10/20/2023&EndDate=10/20/2023',
start: '2023-10-20'
},{
title: '21',
url: 'https://www.nrc.gov/pmns/mtg?do=search.results&pageno=1&StartDate=10/21/2023&EndDate=10/21/2023',
start: '2023-10-21'
},{
title: '22',
url: 'https://www.nrc.gov/pmns/mtg?do=search.results&pageno=1&StartDate=10/22/2023&EndDate=10/22/2023',
start: '2023-10-22'
},{
title: '23',
url: 'https://www.nrc.gov/pmns/mtg?do=search.results&pageno=1&StartDate=10/23/2023&EndDate=10/23/2023',
start: '2023-10-23'
},{
title: '24',
url: 'https://www.nrc.gov/pmns/mtg?do=search.results&pageno=1&StartDate=10/24/2023&EndDate=10/24/2023',
start: '2023-10-24'
},{
title: '25',
url: 'https://www.nrc.gov/pmns/mtg?do=search.results&pageno=1&StartDate=10/25/2023&EndDate=10/25/2023',
start: '2023-10-25'
},{
title: '26',
url: 'https://www.nrc.gov/pmns/mtg?do=search.results&pageno=1&StartDate=10/26/2023&EndDate=10/26/2023',
start: '2023-10-26'
},{
title: '27',
url: 'https://www.nrc.gov/pmns/mtg?do=search.results&pageno=1&StartDate=10/27/2023&EndDate=10/27/2023',
start: '2023-10-27'
},{
title: '28',
url: 'https://www.nrc.gov/pmns/mtg?do=search.results&pageno=1&StartDate=10/28/2023&EndDate=10/28/2023',
start: '2023-10-28'
},{
title: '29',
url: 'https://www.nrc.gov/pmns/mtg?do=search.results&pageno=1&StartDate=10/29/2023&EndDate=10/29/2023',
start: '2023-10-29'
},{
title: '30',
url: 'https://www.nrc.gov/pmns/mtg?do=search.results&pageno=1&StartDate=10/30/2023&EndDate=10/30/2023',
start: '2023-10-30'
},{
title: '31',
url: 'https://www.nrc.gov/pmns/mtg?do=search.results&pageno=1&StartDate=10/31/2023&EndDate=10/31/2023',
start: '2023-10-31'
},{
title: '01',
url: 'https://www.nrc.gov/pmns/mtg?do=search.results&pageno=1&StartDate=11/01/2023&EndDate=11/01/2023',
start: '2023-11-01'
},{
title: '02',
url: 'https://www.nrc.gov/pmns/mtg?do=search.results&pageno=1&StartDate=11/02/2023&EndDate=11/02/2023',
start: '2023-11-02'
},{
title: '03',
url: 'https://www.nrc.gov/pmns/mtg?do=search.results&pageno=1&StartDate=11/03/2023&EndDate=11/03/2023',
start: '2023-11-03'
},{
title: '04',
url: 'https://www.nrc.gov/pmns/mtg?do=search.results&pageno=1&StartDate=11/04/2023&EndDate=11/04/2023',
start: '2023-11-04'
},{
title: '05',
url: 'https://www.nrc.gov/pmns/mtg?do=search.results&pageno=1&StartDate=11/05/2023&EndDate=11/05/2023',
start: '2023-11-05'
},{
title: '06',
url: 'https://www.nrc.gov/pmns/mtg?do=search.results&pageno=1&StartDate=11/06/2023&EndDate=11/06/2023',
start: '2023-11-06'
},{
title: '07',
url: 'https://www.nrc.gov/pmns/mtg?do=search.results&pageno=1&StartDate=11/07/2023&EndDate=11/07/2023',
start: '2023-11-07'
},{
title: '08',
url: 'https://www.nrc.gov/pmns/mtg?do=search.results&pageno=1&StartDate=11/08/2023&EndDate=11/08/2023',
start: '2023-11-08'
},{
title: '09',
url: 'https://www.nrc.gov/pmns/mtg?do=search.results&pageno=1&StartDate=11/09/2023&EndDate=11/09/2023',
start: '2023-11-09'
},{
title: '10',
url: 'https://www.nrc.gov/pmns/mtg?do=search.results&pageno=1&StartDate=11/10/2023&EndDate=11/10/2023',
start: '2023-11-10'
},{
title: '11',
url: 'https://www.nrc.gov/pmns/mtg?do=search.results&pageno=1&StartDate=11/11/2023&EndDate=11/11/2023',
start: '2023-11-11'
},{
title: '12',
url: 'https://www.nrc.gov/pmns/mtg?do=search.results&pageno=1&StartDate=11/12/2023&EndDate=11/12/2023',
start: '2023-11-12'
},{
title: '13',
url: 'https://www.nrc.gov/pmns/mtg?do=search.results&pageno=1&StartDate=11/13/2023&EndDate=11/13/2023',
start: '2023-11-13'
},{
title: '14',
url: 'https://www.nrc.gov/pmns/mtg?do=search.results&pageno=1&StartDate=11/14/2023&EndDate=11/14/2023',
start: '2023-11-14'
},{
title: '15',
url: 'https://www.nrc.gov/pmns/mtg?do=search.results&pageno=1&StartDate=11/15/2023&EndDate=11/15/2023',
start: '2023-11-15'
},{
title: '16',
url: 'https://www.nrc.gov/pmns/mtg?do=search.results&pageno=1&StartDate=11/16/2023&EndDate=11/16/2023',
start: '2023-11-16'
},{
title: '17',
url: 'https://www.nrc.gov/pmns/mtg?do=search.results&pageno=1&StartDate=11/17/2023&EndDate=11/17/2023',
start: '2023-11-17'
},{
title: '18',
url: 'https://www.nrc.gov/pmns/mtg?do=search.results&pageno=1&StartDate=11/18/2023&EndDate=11/18/2023',
start: '2023-11-18'
},{
title: '19',
url: 'https://www.nrc.gov/pmns/mtg?do=search.results&pageno=1&StartDate=11/19/2023&EndDate=11/19/2023',
start: '2023-11-19'
},{
title: '20',
url: 'https://www.nrc.gov/pmns/mtg?do=search.results&pageno=1&StartDate=11/20/2023&EndDate=11/20/2023',
start: '2023-11-20'
},{
title: '21',
url: 'https://www.nrc.gov/pmns/mtg?do=search.results&pageno=1&StartDate=11/21/2023&EndDate=11/21/2023',
start: '2023-11-21'
},{
title: '22',
url: 'https://www.nrc.gov/pmns/mtg?do=search.results&pageno=1&StartDate=11/22/2023&EndDate=11/22/2023',
start: '2023-11-22'
},{
title: '23',
url: 'https://www.nrc.gov/pmns/mtg?do=search.results&pageno=1&StartDate=11/23/2023&EndDate=11/23/2023',
start: '2023-11-23'
},{
title: '24',
url: 'https://www.nrc.gov/pmns/mtg?do=search.results&pageno=1&StartDate=11/24/2023&EndDate=11/24/2023',
start: '2023-11-24'
},{
title: '25',
url: 'https://www.nrc.gov/pmns/mtg?do=search.results&pageno=1&StartDate=11/25/2023&EndDate=11/25/2023',
start: '2023-11-25'
},{
title: '26',
url: 'https://www.nrc.gov/pmns/mtg?do=search.results&pageno=1&StartDate=11/26/2023&EndDate=11/26/2023',
start: '2023-11-26'
},{
title: '27',
url: 'https://www.nrc.gov/pmns/mtg?do=search.results&pageno=1&StartDate=11/27/2023&EndDate=11/27/2023',
start: '2023-11-27'
},{
title: '28',
url: 'https://www.nrc.gov/pmns/mtg?do=search.results&pageno=1&StartDate=11/28/2023&EndDate=11/28/2023',
start: '2023-11-28'
},{
title: '29',
url: 'https://www.nrc.gov/pmns/mtg?do=search.results&pageno=1&StartDate=11/29/2023&EndDate=11/29/2023',
start: '2023-11-29'
},{
title: '30',
url: 'https://www.nrc.gov/pmns/mtg?do=search.results&pageno=1&StartDate=11/30/2023&EndDate=11/30/2023',
start: '2023-11-30'
},{
title: '01',
url: 'https://www.nrc.gov/pmns/mtg?do=search.results&pageno=1&StartDate=12/01/2023&EndDate=12/01/2023',
start: '2023-12-01'
},{
title: '02',
url: 'https://www.nrc.gov/pmns/mtg?do=search.results&pageno=1&StartDate=12/02/2023&EndDate=12/02/2023',
start: '2023-12-02'
},{
title: '03',
url: 'https://www.nrc.gov/pmns/mtg?do=search.results&pageno=1&StartDate=12/03/2023&EndDate=12/03/2023',
start: '2023-12-03'
},{
title: '04',
url: 'https://www.nrc.gov/pmns/mtg?do=search.results&pageno=1&StartDate=12/04/2023&EndDate=12/04/2023',
start: '2023-12-04'
},{
title: '05',
url: 'https://www.nrc.gov/pmns/mtg?do=search.results&pageno=1&StartDate=12/05/2023&EndDate=12/05/2023',
start: '2023-12-05'
},{
title: '06',
url: 'https://www.nrc.gov/pmns/mtg?do=search.results&pageno=1&StartDate=12/06/2023&EndDate=12/06/2023',
start: '2023-12-06'
},{
title: '07',
url: 'https://www.nrc.gov/pmns/mtg?do=search.results&pageno=1&StartDate=12/07/2023&EndDate=12/07/2023',
start: '2023-12-07'
},{
title: '08',
url: 'https://www.nrc.gov/pmns/mtg?do=search.results&pageno=1&StartDate=12/08/2023&EndDate=12/08/2023',
start: '2023-12-08'
},{
title: '09',
url: 'https://www.nrc.gov/pmns/mtg?do=search.results&pageno=1&StartDate=12/09/2023&EndDate=12/09/2023',
start: '2023-12-09'
},{
title: '10',
url: 'https://www.nrc.gov/pmns/mtg?do=search.results&pageno=1&StartDate=12/10/2023&EndDate=12/10/2023',
start: '2023-12-10'
},{
title: '11',
url: 'https://www.nrc.gov/pmns/mtg?do=search.results&pageno=1&StartDate=12/11/2023&EndDate=12/11/2023',
start: '2023-12-11'
},{
title: '12',
url: 'https://www.nrc.gov/pmns/mtg?do=search.results&pageno=1&StartDate=12/12/2023&EndDate=12/12/2023',
start: '2023-12-12'
},{
title: '13',
url: 'https://www.nrc.gov/pmns/mtg?do=search.results&pageno=1&StartDate=12/13/2023&EndDate=12/13/2023',
start: '2023-12-13'
},{
title: '14',
url: 'https://www.nrc.gov/pmns/mtg?do=search.results&pageno=1&StartDate=12/14/2023&EndDate=12/14/2023',
start: '2023-12-14'
},{
title: '15',
url: 'https://www.nrc.gov/pmns/mtg?do=search.results&pageno=1&StartDate=12/15/2023&EndDate=12/15/2023',
start: '2023-12-15'
},{
title: '16',
url: 'https://www.nrc.gov/pmns/mtg?do=search.results&pageno=1&StartDate=12/16/2023&EndDate=12/16/2023',
start: '2023-12-16'
},{
title: '17',
url: 'https://www.nrc.gov/pmns/mtg?do=search.results&pageno=1&StartDate=12/17/2023&EndDate=12/17/2023',
start: '2023-12-17'
},{
title: '18',
url: 'https://www.nrc.gov/pmns/mtg?do=search.results&pageno=1&StartDate=12/18/2023&EndDate=12/18/2023',
start: '2023-12-18'
},{
title: '19',
url: 'https://www.nrc.gov/pmns/mtg?do=search.results&pageno=1&StartDate=12/19/2023&EndDate=12/19/2023',
start: '2023-12-19'
},{
title: '20',
url: 'https://www.nrc.gov/pmns/mtg?do=search.results&pageno=1&StartDate=12/20/2023&EndDate=12/20/2023',
start: '2023-12-20'
},{
title: '21',
url: 'https://www.nrc.gov/pmns/mtg?do=search.results&pageno=1&StartDate=12/21/2023&EndDate=12/21/2023',
start: '2023-12-21'
},{
title: '22',
url: 'https://www.nrc.gov/pmns/mtg?do=search.results&pageno=1&StartDate=12/22/2023&EndDate=12/22/2023',
start: '2023-12-22'
},{
title: '23',
url: 'https://www.nrc.gov/pmns/mtg?do=search.results&pageno=1&StartDate=12/23/2023&EndDate=12/23/2023',
start: '2023-12-23'
},{
title: '24',
url: 'https://www.nrc.gov/pmns/mtg?do=search.results&pageno=1&StartDate=12/24/2023&EndDate=12/24/2023',
start: '2023-12-24'
},{
title: '25',
url: 'https://www.nrc.gov/pmns/mtg?do=search.results&pageno=1&StartDate=12/25/2023&EndDate=12/25/2023',
start: '2023-12-25'
},{
title: '26',
url: 'https://www.nrc.gov/pmns/mtg?do=search.results&pageno=1&StartDate=12/26/2023&EndDate=12/26/2023',
start: '2023-12-26'
},{
title: '27',
url: 'https://www.nrc.gov/pmns/mtg?do=search.results&pageno=1&StartDate=12/27/2023&EndDate=12/27/2023',
start: '2023-12-27'
},{
title: '28',
url: 'https://www.nrc.gov/pmns/mtg?do=search.results&pageno=1&StartDate=12/28/2023&EndDate=12/28/2023',
start: '2023-12-28'
},{
title: '29',
url: 'https://www.nrc.gov/pmns/mtg?do=search.results&pageno=1&StartDate=12/29/2023&EndDate=12/29/2023',
start: '2023-12-29'
},{
title: '30',
url: 'https://www.nrc.gov/pmns/mtg?do=search.results&pageno=1&StartDate=12/30/2023&EndDate=12/30/2023',
start: '2023-12-30'
},{
title: '31',
url: 'https://www.nrc.gov/pmns/mtg?do=search.results&pageno=1&StartDate=12/31/2023&EndDate=12/31/2023',
start: '2023-12-31'
},{
title: '01',
url: 'https://www.nrc.gov/pmns/mtg?do=search.results&pageno=1&StartDate=1/01/2024&EndDate=1/01/2024',
start: '2024-01-01'
},{
title: '02',
url: 'https://www.nrc.gov/pmns/mtg?do=search.results&pageno=1&StartDate=1/02/2024&EndDate=1/02/2024',
start: '2024-01-02'
},{
title: '03',
url: 'https://www.nrc.gov/pmns/mtg?do=search.results&pageno=1&StartDate=1/03/2024&EndDate=1/03/2024',
start: '2024-01-03'
},{
title: '04',
url: 'https://www.nrc.gov/pmns/mtg?do=search.results&pageno=1&StartDate=1/04/2024&EndDate=1/04/2024',
start: '2024-01-04'
}, 
      
    ]
  }
</script>
    </div>
  </div>
</div>
<style type="text/css">div.scbwwbt-content-button a
{
  padding:14px 26px 16px 26px;
}
</style>




<div class="container">
  <div class="row">
    <div class="col-md-12">
      <div class="scbwwbt scbwwbt-bg-image dark-bg img-bg img-bg-soft">
        <span role="img" aria-label="Image is a composite of four photos showing NRC employees performing their various duties and includes a â€œLearn Moreâ€ button which links to the NRC careers webpage. Image also includes text that says, â€œFind Your Career Here!â€"></span>
        <style type="text/css">
          .scbwwbt-bg-image {
            background: url(/images/homepage/careers-widget-mobile.jpg);
            background-repeat: no-repeat !important;
          }
          
          @media only screen and (min-width: 62.5em) {
            .scbwwbt-bg-image {
              background: url(/images/homepage/careers-widget.jpg);
            }
          }
        </style>
        <div class="scbwwbt-content vert-center horiz-center">
          
          
          <div class="scbwwbt-content-button">
            <a href="/about-nrc/employment.html" target="_self" class="btn btn-medium primary-background white">Learn More</a>
          </div>
          
        </div>
      </div>
    </div>
  </div>
</div><div class="container">
<div class="row inner-top-xs">
<div class="col-md-3 col-sm-6">
  <div class="tile-card mg-trigger" id="tile141310">
    <a href="/reading-rm/doc-collections/event-status/index.html"><img class="img-responsive" src="/cdn/site/home-page/generic-event-report2.jpg" alt="Image of person typing on a laptop sitting at a table with a smartphone on the left side and a cup of coffee on the right side of the table." title=""></a>
    <div class="tile-card-content">
      <span class="tile-card-title">Event Reports</span>
      <span class="tile-card-name">Reports Associated with Events.</span>
    </div>
    <a href="/reading-rm/doc-collections/event-status/index.html" class="tile-card-button btn btn-small quaternary-background black">Read More</a>
  </div>
</div><div class="col-md-3 col-sm-6">
  <div class="tile-card mg-trigger" id="tile141311">
    <a href="/reading-rm/adams.html"><img class="img-responsive" src="/cdn/site/home-page/adams2.jpg" alt="Image of computer server room with twelve large tall black servers with small blue lights sitting on a grey floor." title=""></a>
    <div class="tile-card-content">
      <span class="tile-card-title">ADAMS Public Documents</span>
      <span class="tile-card-name">Search and view NRC&#39;s public documents</span>
    </div>
    <a href="/reading-rm/adams.html" class="tile-card-button btn btn-small quaternary-background black">Read More</a>
  </div>
</div><div class="col-md-3 col-sm-6">
  <div class="tile-card mg-trigger" id="tile141312">
    <a href="/public-involve/open.html"><img class="img-responsive" src="/cdn/site/home-page/open-government.jpg" alt="Image of the Nuclear Regulatory Commission's outdoor building signage at their headquarters in Maryland with an American Flag flying next to it." title=""></a>
    <div class="tile-card-content">
      <span class="tile-card-title">Open Government</span>
      <span class="tile-card-name">NRC Approach to Open/Digital Government</span>
    </div>
    <a href="/public-involve/open.html" class="tile-card-button btn btn-small quaternary-background black">Read More</a>
  </div>
</div><div class="col-md-3 col-sm-6">
  <div class="tile-card mg-trigger" id="tile141313">
    <a href="/about-nrc/regulatory/licensing/fees.html#ebilling"><img class="img-responsive" src="/cdn/site/home-page/new-reactor-license.jpg" alt="Image of person holding a tablet computer in their left hand and a credit card in their right hand." title=""></a>
    <div class="tile-card-content">
      <span class="tile-card-title">eBilling</span>
      <span class="tile-card-name">Invoices available On-Line</span>
    </div>
    <a href="/about-nrc/regulatory/licensing/fees.html#ebilling" class="tile-card-button btn btn-small quaternary-background black">Learn More</a>
  </div>
</div><div class="col-md-3 col-sm-6">
  <div class="tile-card mg-trigger" id="tile141314">
    <a href="/reading-rm/basic-ref/students.html"><img class="img-responsive" src="/cdn/site/home-page/students2.jpg" alt="Image of two your girls in yellow protective coats holding remote controls." title=""></a>
    <div class="tile-card-content">
      <span class="tile-card-title">The Student Corner</span>
      <span class="tile-card-name">Information for Students and Teachers</span>
    </div>
    <a href="/reading-rm/basic-ref/students.html" class="tile-card-button btn btn-small quaternary-background black">Read More</a>
  </div>
</div><div class="col-md-3 col-sm-6">
  <div class="tile-card mg-trigger" id="tile141315">
    <a href="/about-nrc/emerg-preparedness/in-radiological-emerg.html"><img class="img-responsive" src="/cdn/site/home-page/nrc-emergency2.jpg" alt="Image of a red emergency light on a black background." title=""></a>
    <div class="tile-card-content">
      <span class="tile-card-title">In a Nuclear Emergency...</span>
      <span class="tile-card-name">Know what to do</span>
    </div>
    <a href="/about-nrc/emerg-preparedness/in-radiological-emerg.html" class="tile-card-button btn btn-small quaternary-background black">Read More</a>
  </div>
</div><div class="col-md-3 col-sm-6">
  <div class="tile-card mg-trigger" id="tile141316">
    <a href="/reading-rm/doc-collections/nuregs/staff/sr1350/index.html"><img class="img-responsive" src="/cdn/legacy/images/homepage/info-digest-cover-widget.jpg" alt="Image with text on it that reads 2022-2023 information digest on top banner U.S NRC with a light black background then contrast with a wave hill bottom right corner in a darker black border; displaying to the right is a white border with blue circle icon label NRC and below white border with a light green circle power plant icon. " title=""></a>
    <div class="tile-card-content">
      <span class="tile-card-title">Information Digest</span>
      <span class="tile-card-name">Agency Data at a Glance</span>
    </div>
    <a href="/reading-rm/doc-collections/nuregs/staff/sr1350/index.html" class="tile-card-button btn btn-small quaternary-background black">Read More</a>
  </div>
</div><div class="col-md-3 col-sm-6">
  <div class="tile-card mg-trigger" id="tile141317">
    <a href="/info-finder.html"><img class="img-responsive" src="/cdn/site/home-page/facility-locator.jpg" alt="Image of map with with the states of Iowa, Illinois, Indiana, Ohio, Missouri, Arkansas, Mississippi, Alabama, South Carolina, North Carolina, and the District of Columbia visible with a magnifying glass over the word Philadelphia." title=""></a>
    <div class="tile-card-content">
      <span class="tile-card-title">Facility Locator</span>
      <span class="tile-card-name">Locate a facility near you</span>
    </div>
    <a href="/info-finder.html" class="tile-card-button btn btn-small quaternary-background black">Locate Now</a>
  </div>
</div>
</div>
</div><div class="pd-30"></div>
  </main>
  <!-- End Content -->
  
  <!-- Begin Above Footer Widget -->
  <div id="p_lt_WebPartZone11_zAfWidget_sys_pnlUpdate">

</div>
  <!-- End Above Footer Widget -->
  
  <!-- Begin Footer -->
  <footer class="dark-bg">
    <!-- Begin Main Footer Content -->
    <div class="container inner-bottom-xs">
      <div class="row">
        <div class="col-md-3 col-sm-6 inner">
          <h4 class='text-left black white-background-heading' >Home</h4>
<div class="footer-link"><a id="f21_btnElem_hyperLink" href="/reading-rm/doc-collections/news/index.html" target="_self"><span id="f21_btnElem_lblText">NEWS RELEASES</span></a></div>

<div class="footer-link"><a id="f211_btnElem_hyperLink" href="/reading-rm/doc-collections/event-status/index.html" target="_self"><span id="f211_btnElem_lblText">EVENT REPORTS</span></a></div>

<div class="footer-link"><a id="f212_btnElem_hyperLink" href="/reading-rm/adams.html" target="_self"><span id="f212_btnElem_lblText">ADAMS</span></a></div>

<div class="footer-link"><a id="f219_btnElem_hyperLink" href="/public-involve/open.html" target="_self"><span id="f219_btnElem_lblText">OPEN GOV</span></a></div>

<div class="footer-link"><a id="f2110_btnElem_hyperLink" href="/public-involve/open/digital-government.html" target="_self"><span id="f2110_btnElem_lblText">DIGITAL GOVERNMENT</span></a></div>

<div class="footer-link"><a id="f2122_btnElem_hyperLink" href="/reading-rm/basic-ref/students.html" target="_self"><span id="f2122_btnElem_lblText">THE STUDENT CORNER</span></a></div>

<div class="footer-link"><a id="f2123_btnElem_hyperLink" href="/reading-rm/photo-gallery/index.html" target="_self"><span id="f2123_btnElem_lblText">PHOTOS &amp; VIDEOS</span></a></div>

<div class="footer-link"><a id="f2124_btnElem_hyperLink" href="/developer.html" target="_self"><span id="f2124_btnElem_lblText">FOR DEVELOPERS</span></a></div>

        </div>
        <div class="col-md-3 col-sm-6 inner">
          <h4 class='text-left black white-background-heading' >About Us</h4>
<div class="footer-link"><a id="f323_btnElem_hyperLink" href="/reading-rm/doc-collections/nuregs/staff/sr1614/index.html" target="_self"><span id="f323_btnElem_lblText">STRATEGIC PLAN</span></a></div>

<div class="footer-link"><a id="f324_btnElem_hyperLink" href="/about-nrc/plans-performance.html" target="_self"><span id="f324_btnElem_lblText">BUDGET &amp; PERFORMANCE</span></a></div>

<div class="footer-link"><a id="f325_btnElem_hyperLink" href="/reading-rm/doc-collections/nuregs/staff/sr2220/index.html" target="_self"><span id="f325_btnElem_lblText">AGENCY FINANCIAL REPORT</span></a></div>

<div class="footer-link"><a id="f3225_btnElem_hyperLink" href="/about-nrc/regulatory/licensing/fees.html" target="_self"><span id="f3225_btnElem_lblText">LICENSE FEES</span></a></div>

<div class="footer-link"><a id="f3226_btnElem_hyperLink" href="/about-nrc/history.html" target="_self"><span id="f3226_btnElem_lblText">HISTORY OF THE NRC</span></a></div>

<div class="footer-link"><a id="f3227_btnElem_hyperLink" href="/about-nrc/employment.html" target="_self"><span id="f3227_btnElem_lblText">CAREER OPPORTUNITIES</span></a></div>

<div class="footer-link"><a id="f3228_btnElem_hyperLink" href="/about-nrc/employment/ethics.html" target="_self"><span id="f3228_btnElem_lblText">NRC ETHICS</span></a></div>

<div class="footer-link"><a id="f3229_btnElem_hyperLink" href="/agency-status/index.html" target="_self"><span id="f3229_btnElem_lblText">AGENCY STATUS</span></a></div>

<div class="footer-link"><a id="f3230_btnElem_hyperLink" href="/about-nrc/covid-19/index.html" target="_self"><span id="f3230_btnElem_lblText">NRC COVID-19 UPDATE</span></a></div>

<div class="footer-link"><a id="f3213_btnElem_hyperLink" href="/about-nrc/contactus.html" target="_self"><span id="f3213_btnElem_lblText">CONTACT US</span></a></div>

        </div>
        <div class="col-md-3 col-sm-6 inner">
          <h4 class='text-left black white-background-heading' >Popular Documents</h4>
<div class="footer-link"><a id="f436_btnElem_hyperLink" href="/reading-rm/doc-collections/nuregs/staff/sr1350/index.html" target="_self"><span id="f436_btnElem_lblText">INFO DIGEST</span></a></div>

<div class="footer-link"><a id="f437_btnElem_hyperLink" href="/reading-rm/doc-collections/fact-sheets/index.html" target="_self"><span id="f437_btnElem_lblText">FACT SHEETS &amp; BROCHURES</span></a></div>

<div class="footer-link"><a id="f438_btnElem_hyperLink" href="/reading-rm/doc-collections/forms/index.html" target="_self"><span id="f438_btnElem_lblText">FORMS</span></a></div>

<div class="footer-link"><a id="f4331_btnElem_hyperLink" href="/site-help/e-submittals.html" target="_self"><span id="f4331_btnElem_lblText">ELECTRONIC SUBMITTALS APPLICATION</span></a></div>

<div class="footer-link"><a id="f4332_btnElem_hyperLink" href="/site-help/e-submittals/adjudicatory-sub.html" target="_self"><span id="f4332_btnElem_lblText">ADJUDICATORY SUBMISSIONS</span></a></div>

<div class="footer-link"><a id="f4333_btnElem_hyperLink" href="/reading-rm/doc-collections/nuregs/index.html" target="_self"><span id="f4333_btnElem_lblText">NRC REPORTS - NUREG</span></a></div>

<div class="footer-link"><a id="f4334_btnElem_hyperLink" href="/reading-rm/doc-collections/cfr.html" target="_self"><span id="f4334_btnElem_lblText">NRC REGULATIONS - 10-CFR</span></a></div>

<div class="footer-link"><a id="f4335_btnElem_hyperLink" href="/reactors/operating/oversight/listofrpts-body.html" target="_self"><span id="f4335_btnElem_lblText">INSPECTION REPORTS</span></a></div>

<div class="footer-link"><a id="f4336_btnElem_hyperLink" href="/public-involve/open/plain-writing.html" target="_self"><span id="f4336_btnElem_lblText">PLAIN WRITING</span></a></div>

<div class="footer-link"><a id="f4337_btnElem_hyperLink" href="/about-nrc/regulatory/enforcement/current.html" target="_self"><span id="f4337_btnElem_lblText">ENFORCEMENT ACTIONS</span></a></div>

<div class="footer-link"><a id="f4338_btnElem_hyperLink" href="/about-nrc/regulatory/rulemaking.html" target="_self"><span id="f4338_btnElem_lblText">RULEMAKING</span></a></div>

<div class="footer-link"><a id="f4339_btnElem_hyperLink" href="/reading-rm/basic-ref/glossary.html" target="_self"><span id="f4339_btnElem_lblText">GLOSSARY</span></a></div>

        </div>
        <div class="col-md-3 col-sm-6 inner">
          <h4 class='text-left black white-background-heading' >Stay Connected</h4>
<div class="footer-social">
  <!--Facebook-->
  <span class='footer-social-media'><a href='https://www.facebook.com/nrcgov/' target='_blank' title='NRC Facebook' rel='noopener noreferrer'><i class='icon-fontello-s-facebook'></i></a></span>
  <!--Twitter-->
  <span class='footer-social-media'><a href='https://twitter.com/nrcgov' target='_blank' title='NRC Twitter Feed' rel='noopener noreferrer'><i class='icon-fontello-s-twitter'></i></a></span>
  <!--Linkedin-->
  <span class='footer-social-media'><a href='https://www.linkedin.com/company/u-s--nuclear-regulatory-commission/' target='_blank' title='NRC Linkedin' rel='noopener noreferrer'><i class='icon-fontello-s-linkedin'></i></a></span>
  <!--Instagram-->
  <span class='footer-social-media'><a href='https://www.instagram.com/nrcgov' target='_blank' title='NRC Instagram' rel='noopener noreferrer'><i class='icon-fontello-s-instagram'></i></a></span>
  <!-- YouTube -->
  <span class='footer-social-media'><a href='https://www.youtube.com/user/NRCgov' target='_blank' title='NRC YouTube Channel' rel='noopener noreferrer'><i class='icon-fontello-s-youtube'></i></a></span>
  <!-- Pinterest -->
  
   <!-- Subscription -->
  <span class='footer-social-media'><a href='https://service.govdelivery.com/service/multi_subscribe.html?code=USNRC' target='_blank' title='NRC Email Subscriptions - GovDelivery' rel='noopener noreferrer'><i class='icon-fontello-comment'></i></a></span>
  <!-- Flickr -->
  <span class='footer-social-media'><a href='https://www.flickr.com/photos/nrcgov/sets' target='_blank' title='NRC Flickr Gallery' rel='noopener noreferrer'><i class='icon-fontello-s-flickr'></i></a></span>
  <!-- Blog -->
  <span class='footer-social-media'><a href='https://public-blog.nrc-gateway.gov/' target='_blank' title='NRC Blog Archived' rel='noopener noreferrer'><i class='icon-fontello-pencil'></i></a></span>
  <!-- RSS -->
  <span class='footer-social-media'><a href='/public-involve/listserver.html#rss' target='_self' title='NRC RSS Feed'><i class='icon-fontello-rss'></i></a></span>
</div>


        </div>
      </div>
    </div>
    <!-- End Main Footer Content -->
    
    <!-- Begin Lined Footer Logo -->
    
    <div class="footer-lines"><span><img src="/cdn/site/logo/pr-seal.png" alt="United States Nuclear Regulatory Commission"/></span></div>
    
    <!-- End Lined Footer Logo -->
    
    <!-- Begin Sub Footer Content -->
    <div class="footer-bottom">
      <div class="container inner">
        <div class="footer-menu text-center">
          
<div class="footer-link"><a id="f611_btnElem_hyperLink" href="https://www.regulations.gov/" target="_blank"><span id="f611_btnElem_lblText">Regulations.gov</span></a></div>

<div class="footer-link"><a id="f612_btnElem_hyperLink" href="https://www.usa.gov/" target="_blank"><span id="f612_btnElem_lblText">USA.gov</span></a></div>

<div class="footer-link"><a id="f614_btnElem_hyperLink" href="/reading-rm/foia/foia-privacy.html" target="_self"><span id="f614_btnElem_lblText">FOIA</span></a></div>

<div class="footer-link"><a id="f615_btnElem_hyperLink" href="/about-nrc/civil-rights/crp/dca.html" target="_self"><span id="f615_btnElem_lblText">No Fear EEO</span></a></div>

<div class="footer-link"><a id="f616_btnElem_hyperLink" href="https://nrcoig.oversight.gov" target="_self"><span id="f616_btnElem_lblText">Inspector General</span></a></div>

<div class="footer-link"><a id="f617_btnElem_hyperLink" href="/site-help/site-map.html" target="_self"><span id="f617_btnElem_lblText">Site Map</span></a></div>

<div class="footer-link"><a id="f618_btnElem_hyperLink" href="/site-help/access.html" target="_self"><span id="f618_btnElem_lblText">Accessibility</span></a></div>

<div class="footer-link"><a id="f619_btnElem_hyperLink" href="/site-help/privacy.html" target="_self"><span id="f619_btnElem_lblText">Privacy Policy</span></a></div>

<div class="footer-link"><a id="f620_btnElem_hyperLink" href="/site-help/disclaimer.html" target="_self"><span id="f620_btnElem_lblText">Site Disclaimer</span></a></div>

<div class="footer-link"><a id="f621_btnElem_hyperLink" href="/employee-info.html" target="_self"><span id="f621_btnElem_lblText">For Employees</span></a></div>

        </div>
      </div>
    </div>
    <!-- End Sub Footer Content -->
  </footer>
  <!-- End Footer -->
</div>

<script type="text/javascript">
  function downloadJSAtOnload() {
    var element = document.createElement("script");
    element.src = '/working/nrcweb/js/bundler.A4E3D35F27E2858D792185342B1350D7.js';
    document.body.appendChild(element);
  }
  if (window.addEventListener)
    window.addEventListener("load", downloadJSAtOnload, false);
  else if (window.attachEvent)
    window.attachEvent("onload", downloadJSAtOnload);
  else window.onload = downloadJSAtOnload;
</script>
    
        
    

<script type="text/javascript">
//<![CDATA[

var callBackFrameUrl='/WebResource.axd?d=beToSAE3vdsL1QUQUxjWdXmBkS78JYvjrcvcDkSO3j50RCIvOrrjWM_vqH8P3jZsBraaDB82YTwv80csJViKHw2&t=637814653746327080';
WebForm_InitCallback();
theForm.oldSubmit = theForm.submit;
theForm.submit = WebForm_SaveScrollPositionSubmit;

theForm.oldOnSubmit = theForm.onsubmit;
theForm.onsubmit = WebForm_SaveScrollPositionOnSubmit;
//]]>
</script>
